"question","answer","explanation","difficulty"
"Quels sont les trois objectifs devant une hématurie selon le document ?","1. Affirmer la présence d’une hématurie ; 2. Déterminer l’origine ; 3. Rechercher l’étiologie.","Liste dans ''Objectifs''.","Easy"
"Citez deux examens biologiques à prescrire dans le bilan d’une hématurie.","Exemples : ECBU, protéinurie, microalbuminurie, urée, créatininémie, protidémie, dosage du complément C3. (Deux suffisent)","Liste dans ''BILANS A PRESCRIRE''.","Easy"
"Quelle est la différence entre microhématurie et macrohématurie selon le Compte d’Addis ?","Microhématurie : > 5.000 GR/mn ; Macrohématurie : > 500.000 GT/mn.","Le document donne ces deux valeurs.","Medium"
"Expliquez ce que signifie la ''permanence'' de l’hématurie et ses types.","La permanence décrit à quel moment de la miction apparaît le sang : initiale (début), terminale (fin), ou totale (tout le long).","Le document : ''Permanence : initiale, terminale, totale''.","Medium"
"Pourquoi la thrombose vasculaire peut-elle provoquer une hématurie et dans quels contextes survient-elle ?","La thrombose vasculaire rénale entraîne une nécrose ou une congestion, libérant du sang dans les urines. Elle survient surtout lors d’asphyxie périnatale, de déshydratation, ou de syndrome néphrotique.","Le document : ''Thrombose vasculaire (survient surtout au cours de : asphyxie périnatale, déshydratation, syndrome néphrotique)''.","Medium"
"Quelles sont les étiologies non glomérulaires d’origine tumorale citées ?","Néphroblastome et rhabdomyosarcome vésical.","Le document : ''Tumeurs : néphroblastome, rhabomyosarcome vésical''.","Medium"
"Expliquez le mécanisme de l’hématurie au cours de la drépanocytose selon le document.","La drépanocytose entraîne une congestion et une nécrose papillaire rénale, ce qui provoque l’hématurie.","Le document : ''Drépanocytose (congestion et nécrose papillaire)''.","Difficult"