question,answer,explanation,difficulty
"Définissez la rhinosinusite aiguë de l’adulte et précisez sa durée d’évolution. Quels sont les deux signes hautement évocateurs ?",La rhinosinusite aiguë est une infection aiguë d’une ou de plusieurs cavités rhinosinusiennes. Sa durée d’évolution est inférieure à 3 semaines. Les deux signes hautement évocateurs sont : la rhinorrhée purulente (jaunâtre ou verdâtre) et les algies faciales (douleurs de la face). Ces signes, associés à une obstruction nasale à bascule et parfois à une fièvre modérée, orientent fortement le diagnostic. Le document indique : Infection aiguë d’une ou de plusieurs cavités rhinosinusiennes, Evolution inférieur à 3 semaines, Rhinorrhée purulente + algies faciales : hautement évocatrices.,Le document donne ces définitions.","Medium"
"Expliquez le rôle du drainage mucociliaire dans la physiologie des sinus et comment son altération conduit à la sinusite.",Le drainage mucociliaire est un mécanisme de défense de surface essentiel : les cils vibratiles de la muqueuse sinusienne battent de façon coordonnée pour évacuer toutes les particules étrangères, les bactéries et le mucus vers l’ostium du sinus, puis vers les fosses nasales à travers les méats (moyen pour les sinus antérieurs, supérieur pour les postérieurs), puis vers le cavum par les choanes. L’obstruction de l’ostium (par œdème inflammatoire, polype, déviation septale, hypertrophie des cornets) altère ce drainage. Le mucus stagne, les bactéries prolifèrent, la pression augmente, et l’infection s’installe (sinusite). Le document précise : Drainage mucociliaire : Evacuation de toutes particules étrangères. Obstruction de l’ostium -> altération du drainage (infection).,Le document décrit le drainage mucociliaire.","Medium"
"Décrivez le tableau clinique typique (TDD) de la rhinosinusite aiguë d’origine dentaire.",Le TDD associe : Interrogatoire : notion de rage dentaire récente, épisode fébrile d’apparition brutale, ATCD nasosinusiens et allergiques. Signes généraux : état général conservé, asthénie par insomnie et douleur, faciès infecté. Signes fonctionnels : rhinorrhée purulente (jaunâtre/verdâtre), douleur faciale ou crânienne, obstruction nasale à bascule (alternant selon la position), sensation d’écoulement postérieur (jetage postérieur), cacosmie (mauvaise odeur). Signes physiques : douleur à la palpation des points sinusiens, pus au méat moyen à la rhinoscopie antérieure, recherche de causes obstructives nasales. Cavité orale : retrouve la dent causale (dents sinusiennes : 15-16-17/25-26-27). Le document détaille ce TDD.,Le document détaille le TDD.","Medium"
"Quelles sont les incidences radiographiques à demander dans la rhinosinusite aiguë et que recherche-t-on ?",Les incidences radiographiques à demander sont : Blondeau (incidence occipito-mentonnière pour visualiser les sinus maxillaires et frontaux), Face haute (incidence fronto-nasale pour les sinus frontaux et ethmoïdaux antérieurs), Profil (pour les sinus sphénoïdaux et l’ethmoïde postérieur). On recherche une opacité au niveau des sinus maxillaires (image caractéristique de la sinusite). L’absence d’aération complète définit la sinusite bloquée, seule indication de ponction sinusienne. Le panoramique dentaire complète le bilan pour rechercher une cause dentaire (clarté ou aspect soufflé de l’os alvéolaire). Le document cite : Radiographie des sinus : Blondeau, Face haute, Profil ; Opacité au niveau des sinus maxillaires.,Le document liste les incidences radiographiques.","Medium"
"Expliquez ce qu’est la sinusite bloquée, pourquoi elle est particulièrement douloureuse et quelle est sa prise en charge spécifique.",La sinusite bloquée est une forme clinique où l’ostium du sinus est complètement obstrué (par œdème, mucus épais, pus). Il n’y a plus d’aération ni de drainage. La pression augmente considérablement dans le sinus, d’où une algie faciale très intense et insupportable. La radiographie montre une opacité franche (totale) du sinus sans niveau hydro-aérique. C’est la seule forme clinique qui nécessite une ponction-drainage chirurgicale (ponction maxillaire ou frontale) pour évacuer le pus, rétablir la ventilation et soulager la douleur. L’antibiothérapie et les anti-inflammatoires sont associés. Le document précise : Sinusite bloquée : Algie faciale très intense et insupportable. Radiographie : opacité franche du sinus. Seule forme clinique qui nécessite une ponction-drainage chirurgicale.,Le document décrit la sinusite bloquée.","Difficult"
"Quels sont les mécanismes de défense de surface des sinus décrits dans le document ?",Les mécanismes de défense de surface sont : 1) Drainage mucociliaire : évacuation des particules étrangères des sinus vers les fosses nasales (méats) puis le cavum (choanes). L’obstruction de l’ostium altère ce drainage. 2) Constituants du mucus : mucine, lysozymes, immunoglobulines, transferrine, antioxydants, qui luttent contre les bactéries. 3) Oxyde nitrique (NO) : produit en grande quantité au niveau des sinus, il a des propriétés antibactériennes et antivirales. 4) Mécanisme de défense tissulaire : NALT (Nose Associated Lymphoid Tissue) qui défend l’organisme contre les antigènes ayant franchi la barrière muco-épithéliale. Le document détaille ces quatre mécanismes.,Le document liste ces mécanismes.","Medium"
"Citez les complications de la rhinosinusite aiguë et expliquez le mécanisme des complications méningo-encéphaliques.",Les complications sont : ostéite, complications oculaires et orbitaires (abcès orbitaire, cellulite orbitaire), otite, laryngite, complications méningo-encéphaliques (méningite, encéphalite, abcès cérébral). Les complications méningo-encéphaliques surviennent par extension de l’infection à travers les parois osseuses des sinus (notamment le toit de l’ethmoïde, la paroi postérieure du sinus frontal) ou par thrombophlébite des veines émissaires, permettant aux germes d’atteindre les méninges et le parenchyme cérébral. Elles engagent le pronostic vital. Le document cite ces complications.,Le document liste les complications.","Difficult"
"Quels sont les diagnostics différentiels de la rhinosinusite aiguë mentionnés dans le document ?",Les diagnostics différentiels sont : 1) Autres causes de douleur faciale : algies faciales (névralgies, céphalées vasomotrices), migraines. 2) Affections tumorales nasosinusiennes : obstruction nasale et épistaxis (tumeurs qui saignent facilement). 3) Infections spécifiques : VIH (sinusite récidivante), tuberculose des sinus (granulomatose), mycose des sinus (aspergillose, mucormycose chez l’immunodéprimé). Le document cite ces diagnostics différentiels.,Le document liste les diagnostics différentiels.","Medium"
"Quel est le traitement antibiotique recommandé dans la rhinosinusite aiguë d’origine dentaire et pourquoi ?",La rhinosinusite aiguë d’origine dentaire implique des germes mixtes : aérobies (Streptococcus, Haemophilus, Staphylococcus) et surtout anaérobies (bactéries de la flore buccale : Peptostreptococcus, Fusobacterium, Porphyromonas). L’antibiothérapie doit donc être active sur les anaérobies. L’association amoxicilline-acide clavulanique (Augmentin) est le traitement de choix (couvre les aérobies et anaérobies). En cas d’allergie aux pénicillines, on utilise un macrolide (clindamycine ou métronidazole) ou une fluoroquinolone antipneumococcique. Un avis dentaire pour avulsion ou soin de la dent causale est indispensable. Le document précise : ATB actif sur les anaérobies (si rhinosinusite d’origine dentaire).,Le document mentionne l’antibiothérapie adaptée aux anaérobies.","Difficult"
"Expliquez l’importance de l’examen des dents sinusiennes dans le diagnostic étiologique de la rhinosinusite aiguë.",Les dents sinusiennes (prémolaires et molaires maxillaires : 15,16,17 à droite ; 25,26,27 à gauche) ont leurs racines en contact direct avec le plancher du sinus maxillaire, parfois séparées seulement par une fine couche osseuse (voire sans os). Une carie profonde, un chicot, une pulpite, une infection péri-apicale, ou une fistule oro-antrale peut se propager directement au sinus maxillaire, provoquant une rhinosinusite aiguë unilatérale (d’origine dentaire). L’examen de la cavité orale (palpation, percussion, radiographie panoramique dentaire) retrouve la dent causale. Traiter la dent (avulsion, soin endodontique) est nécessaire à la guérison. Le document insiste : Ne pas oublier d’examiner les dents sinusiennes.,Le document souligne l’importance des dents sinusiennes.","Medium"
"Quelles sont les causes rhinogènes de la rhinosinusite aiguë ?",Les causes rhinogènes sont de deux types : 1) Causes obstructives : déviation septale (obstruction d’un côté), hypertrophie du cornet inférieur ou moyen (turgescence, aspect polypoïde), polypes nasaux, pied de cloison, masses anormales (tumeurs). Ces obstacles bloquent le drainage des sinus par l’ostium. 2) Causes allergiques : rhinite allergique entraînant un œdème de la muqueuse nasale et des ostiums. Le document cite : Causes obstructives (déviation septale, hypertrophie cornet, polype nasal) et Causes allergiques (rhinite allergique).,Le document liste les causes rhinogènes.","Medium"
"Quel est l’intérêt de la rhinoscopie antérieure dans le diagnostic de la rhinosinusite aiguë ?",La rhinoscopie antérieure permet : 1) De visualiser la présence de pus au niveau du méat moyen (signe direct de sinusite). 2) De rechercher les causes locales d’obstruction nasale : déviation septale (vers quel côté), cornets inférieurs et moyens turgescents ou polypoïdes, masses anormales (polypes, tumeurs). 3) De guider le traitement (indication chirurgicale si obstruction sévère). C’est un examen simple, rapide, réalisable en consultation. Le document indique : Rhinoscopie antérieure : Pus au niveau du méat moyen, Recherche des causes locales d’obstruction nasale.,Le document décrit l’intérêt de la rhinoscopie antérieure.","Medium"
"Quelles sont les indications chirurgicales dans la rhinosinusite aiguë et ses séquelles ?",Les indications chirurgicales sont : 1) En urgence : sinusite bloquée (douleur intense, opacité franche) → ponction-drainage maxillaire ou frontal. Ethmoïdite de l’enfant avec abcès sous-périosté → drainage chirurgical. 2) Pour les causes obstructives : septoplastie (déviation septale), turbinoplastie (hypertrophie des cornets, la turbinectomie étant abandonnée). 3) Pour les formes récidivantes ou la chronicisation : méatotomie moyenne (élargissement de l’ostium du sinus maxillaire pour améliorer le drainage). 4) Pour les causes dentaires : avulsion ou soins dentaires de la dent causale. Le document détaille ces indications.,Le document liste les indications chirurgicales.","Medium"
"Expliquez le mécanisme de l’obstruction nasale à bascule caractéristique de la rhinosinusite aiguë.",L’obstruction nasale à bascule (alternante) est due au cycle nasal physiologique : les cornets inférieurs se dilatent et se contractent alternativement d’un côté puis de l’autre (cycle nasal, période de 2-4 heures). En cas d’inflammation de la muqueuse nasale (rhinite associée), l’œdème préexistant majore l’obstruction du côté où le cornet est naturellement dilaté. Lorsque le patient se tourne sur le côté, le cornet du côté déclive se remplit (effet de la gravité) et obstrue cette narine, tandis que le côté non décliné se dégage. Le patient perçoit donc une obstruction qui change de côté selon sa position (d’où le terme à bascule). Le document décrit : Obstruction nasale à bascule (rehefa matory mirirana dia tsentsina ny ilany, rehefa mivadika dia tsentsina indray ny ilany).,Le document mentionne ce signe.","Difficult"
"Pourquoi la rhinosinusite aiguë est-elle considérée comme un diagnostic essentiellement clinique ?",Le diagnostic de rhinosinusite aiguë repose avant tout sur l’interrogatoire et l’examen clinique : rhinorrhée purulente + algies faciales + obstruction nasale à bascule + cacosmie + douleur à la palpation des points sinusiens + pus au méat moyen à la rhinoscopie. Les examens paracliniques (radiographie, scanner, bilan biologique) ne sont pas nécessaires pour poser le diagnostic dans les formes typiques. Ils sont réservés aux formes compliquées, aux échecs thérapeutiques, aux suspicions de cause tumorale ou aux bilans préopératoires. Le document indique : Examens biologiques : Non nécessaires pour poser le diagnostic ; Diagnostic essentiellement clinique.,Le document conclut ainsi.","Medium"