"term","definition","contextual_explanation"
"allaitement maternel direct","Tétée au sein.","Le fait de nourrir un bébé avec son propre lait de manière directe."
"allaitement maternel indirect","Tirage du lait et administration au bébé (cuillère, biberon, sonde gastrique).","Une forme d'allaitement où la mère tire son lait et le donne par d'autres moyens que le sein."
"lait maternel","Lait produit par la femme, spécifique d'espèce.","Recommandé par l'OMS pendant les six premiers mois pour une croissance et un développement optimaux."
"OMS","Organisation Mondiale de la Santé.","Recommande l'allaitement maternel exclusif pendant six mois et a fixé une cible mondiale de nutrition à 50% d'allaitement maternel exclusif en 2025."
"UNICEF","Fonds des Nations Unies pour l'enfance.","Partenaire de l'OMS dans les recommandations sur l'allaitement."
"structure glandulaire du sein","Lobules -> lobes galactophores (lactifères) retrouvés surtout au niveau du mamelon.","Une des cinq structures anatomiques du sein impliquées dans l'allaitement."
"système myoépithélial","Système musculaire autonome des acinus fonctionnant grâce à l'ocytocine.","Permet la contraction des cellules myoépithéliales pour l'éjection du lait."
"acinus","Unité fonctionnelle sécrétrice du sein.","Entouré de cellules myoépithéliales à activité contractile et d'une membrane basale."
"zone aréolaire","Zone pigmentée autour du mamelon comprenant l'aréole et le mamelon.","Repère visuel et olfactif (glandes de Montgomery), zone érectile (mamelon = fibres musculaires lisses)."
"glandes de Montgomery","Glandes sébacées de l'aréole.","Constituent un repère olfactif pour le nouveau-né."
"cellules épithéliales sécrétantes","Cellules de la paroi des acini qui produisent le lait.","Reposent sur des cellules myoépithéliales."
"cellules myoépithéliales","Cellules contractiles entourant les acini.","Leur contraction, sous l'effet de l'ocytocine, permet l'éjection du lait."
"lactogenèse","Processus de production et de sécrétion du lait.","Comprend plusieurs phases : grossesse, accouchement (colostrum), montée laiteuse (lait de transition), puis lait mature."
"colostrum","Premier lait sécrété après l'accouchement, épais et peu abondant (20-50 ml).","Riche en minéraux, protéines et anticorps (immunoglobulines). Surnommé « 1er vaccin »."
"montée laiteuse","Phase survenant à J2-J3 après l'accouchement.","Correspond au lait de transition, sous l'effet de la prolactine et de l'ocytocine."
"lait de transition","Lait produit entre la montée laiteuse et J15.","Sa composition évolue : diminution des protéines et Ig, augmentation du lactose, lipides et valeur énergétique."
"lait mature","Lait définitif à partir de J8-J15.","Assure la croissance, le développement cérébral et visuel, et la mise en place du système immunitaire."
"prolactine","Hormone antéhypophysaire.","Permet la fabrication du lait (réflexe de sécrétion). Sa sécrétion est surtout nocturne. Augmentée par dompéridone ou métoclopramide, diminuée par bromocriptine et lisuride."
"ocytocine","Hormone post-hypophysaire.","Permet la contraction des cellules myoépithéliales et l'évacuation du lait (réflexe d'éjection). Sa production est diminuée par le stress, la douleur, l'alcool et la nicotine."
"dompéridone","Médicament prokinétique.","Augmente la sécrétion de prolactine."
"métoclopramide","Médicament antiémétique et prokinétique.","Augmente la sécrétion de prolactine."
"bromocriptine (Parlodel)","Médicament dopaminergique.","Diminue la sécrétion de prolactine."
"lisuride (Arolac/Dopergine)","Médicament agoniste dopaminergique.","Diminue la sécrétion de prolactine."
"FIL","Facteur Inhibiteur de la Lactation.","Sécrété en même temps que le lait. Plus le bébé tête, moins il y a de FIL, plus le lait est sécrété. Régulation locale autocrine."
"réflexe d'éjection","Contraction des cellules myoépithéliales sous l'effet de l'ocytocine.","Essentiel à l'extraction du lait, inhibé par le stress."
"lactose","Glucide principal du lait maternel (7%).","Constitué de glucose + galactose. Fournit 40% des besoins énergétiques, participe au développement du SNC, favorise l'absorption du fer et du calcium."
"oligosaccharides","Glucides complexes du lait maternel.","Participent à l'élaboration des bifidobactéries (rôle protecteur antibactérien). Favorisent la prolifération des bifidobactéries. Non produits artificiellement."
"bifidobactéries","Bactéries probiotiques du microbiote intestinal.","Favorisées par les oligosaccharides du lait maternel, elles préviennent les infections et allergies."
"triglycérides à chaîne moyenne (TCM)","Lipides à chaîne carbonée moyenne.","Présents dans le lait maternel, incluent les oméga 3 (DHA) et oméga 6 (acide arachidonique). Rôle dans le développement cognitif."
"acides gras essentiels","Acides gras que l'organisme ne peut synthétiser.","Présents en fin de tétée. Indispensables pour la croissance et le développement nerveux."
"lipase du lait maternel","Enzyme digestive des lipides.","Absente du lait de vache, elle permet la digestion des acides gras."
"caséine","Fraction protéique du lait formant le caillé.","Dans le lait maternel, elle est facilement digérée (contrairement à celle du lait de vache). Elle empêche l'adhésion des bactéries et virus."
"lactosérum","Fraction protéique du lait correspondant au petit lait.","Contient acides aminés, enzymes (lipase, lactase), IgA, α-lactalbumine, lysozyme, lactoferrine, peu de β-lactoglobuline."
"α-lactalbumine","Protéine du lactosérum.","Entre dans la fabrication du lactose."
"lysozyme","Enzyme antibactérienne.","Présente dans le lactosérum, détruit les bactéries."
"lactoferrine","Protéine de transport du fer.","Présente dans le lait maternel, a un effet anti-inflammatoire (blocage de l'activité des cytokines)."
"β-lactoglobuline","Protéine allergisante du lait de vache.","Peu présente dans le lait maternel."
"macrophages","Cellules immunitaires.","Dans le lait maternel, ils assurent la phagocytose et destruction des bactéries, produisent du complément (C3, C4), sécrètent lysozyme et lactoferrine."
"leucocytes PNN","Polynucléaires neutrophiles.","Composants cellulaires du lait maternel."
"lymphocytes B et T","Cellules de l'immunité adaptative.","Les B synthétisent les immunoglobulines, les T sont produits au niveau du thymus."
"lactobacillus","Bactérie probiotique.","Favorise la croissance de lactobifidus (effet probiotique)."
"IgA","Immunoglobulines A.","Représentent 80% des anticorps du lait maternel, 10 fois plus dans le colostrum. Empêchent les bactéries pathogènes de s'attacher au niveau intestinal. Produites par le système MALT (cycle entéro-mammaire)."
"MALT","Mucosa-Associated Lymphoid Tissue (tissu lymphoïde associé aux muqueuses).","Cycle entéro-mammaire : les plasmocytes intestinaux migrent vers la glande mammaire pour y sécréter des IgA."
"cytokines","Molécules de signalisation immunitaire.","Dans le lait maternel : TNFα, IL1, IL6, IL8, IL10, interféron."
"microbiote intestinal","Ensemble des micro-organismes colonisant l'intestin.","Le lait maternel favorise un microbiote riche en Bifidobacterium et Lactobacillus, avec moins d'E. coli et Clostridium difficile."
"colostrum","Premier lait (20-50 ml).","Coloration orangée (β-carotène), plus riche en protéines, minéraux, Ig (10 fois plus), moins riche en lactose et lipides. Valeur énergétique 58 kcal/dl."
"lait de transition","Lait de la montée laiteuse jusqu'à J15.","Diminution des protéines et Ig, augmentation du lactose, lipides, valeur énergétique. Augmentation des vitamines hydrosolubles, diminution des liposolubles."
"peau à peau","Contact direct entre la peau du bébé et celle de la mère (ou du père).","Recommandé immédiatement après la naissance (30 minutes) pour favoriser la première tétée."
"expression manuelle du lait","Technique manuelle pour extraire le lait.","Nécessite lavage des mains, massage des seins, puis pression des pulpes de l'index et du pouce en vis-à-vis autour de l'aréole."
"tire-lait","Dispositif mécanique ou électrique pour tirer le lait.","Mentionné comme alternative à l'expression manuelle."
"AFSSA","Agence Française de Sécurité Sanitaire des Aliments (devenue ANSES).","A émis des recommandations sur la conservation du lait maternel : 48h au frigo (4°C), 4 mois au congélateur (-18°C)."
"entérocolite ulcéro-nécrosante (ECUN)","Maladie intestinale grave du nouveau-né.","L'allaitement maternel diminue le risque d'ECUN."
"maladie cœliaque","Entéropathie auto-immune déclenchée par le gluten.","L'allaitement maternel diminue le risque de maladie cœliaque."
"maladie de Crohn","Maladie inflammatoire chronique de l'intestin.","L'allaitement maternel diminue le risque de maladie de Crohn."
"hémorragie du post-partum","Saignement abondant après l'accouchement.","L'allaitement diminue ce risque grâce à l'ocytocine qui provoque la contraction utérine."
"méthode MAMA","Méthode de l'allaitement maternel et de l'aménorrhée.","Méthode contraceptive naturelle efficace à 98% sous trois conditions : bébé <6 mois, aménorrhée, allaitement exclusif (consensus de Bellagio)."
"consensus de Bellagio","Accord international sur les critères d'efficacité contraceptive de l'allaitement.","Définit les trois conditions pour que la méthode MAMA soit efficace."
"galactosémie congénitale","Maladie héréditaire du métabolisme du galactose.","Contre-indication à l'allaitement maternel car le lait contient du lactose (glucose+galactose)."
"VHB","Virus de l'hépatite B.","Contre-indication générale à l'allaitement."
"VHC","Virus de l'hépatite C.","Contre-indication générale à l'allaitement."
"VIH","Virus de l'immunodéficience humaine.","Contre-indication générale à l'allaitement."
"galactophorite","Inflammation des canaux galactophores.","Contre-indication locale à l'allaitement."
"abcès collecté du sein","Collection purulente dans le sein.","Contre-indication locale à l'allaitement."
"macro-adénome à prolactine","Tumeur hypophysaire bénigne sécrétant de la prolactine.","Contre-indication à l'allaitement."
"engorgement mammaire","Douleurs mammaires intenses avec fièvre à 38°C, frissons, gêne à l'écoulement du lait.","Une complication de l'allaitement."
"mastite","Inflammation du sein souvent infectieuse.","Complication de l'allaitement."
"abcès du sein","Collection purulente intra-mammaire.","Complication sévère de l'allaitement."
"gerçures","Fissures douloureuses du mamelon.","Lésion du mamelon, complication fréquente."
"crévasses","Fissures profondes du mamelon.","Lésion du mamelon."