"front","back","cognitive_level"
"Définition de l’atrésie de l’œsophage","Interruption de la lumière œsophagienne avec deux culs-de-sac pouvant être borgnes ou fistulisés dans les voies respiratoires.","Recall"
"Cause embryologique de l’atrésie de l’œsophage","Trouble de l’embryogenèse entre la 4e et la 6e semaine de développement.","Understanding"
"Signe anténatal principal de l’atrésie de l’œsophage","Hydramnios dû à l’absence de déglutition du liquide amniotique par le fœtus.","Understanding"
"Signe clinique néonatal typique","Hypersialorrhée et fausses routes lors de la première tétée.","Application"
"Objectif du traitement chirurgical","Rétablir la continuité œsophagienne et fermer les fistules.","Analysis"
