"question","answer","explanation","difficulty"
"L’exophtalmie est définie comme une protrusion du globe oculaire en dehors de l’orbite.","True","Le document indique : « Protrusion du globe oculaire en dehors de l’orbite, due à une augmentation de volume de son contenu ».","Easy"
"La valeur normale à l’exophtalmomètre de Hertel est de 25 mm.","False","Le document précise : « Normal à 18mm environ ».","Easy"
"Une exophtalmie est retenue si la différence entre les deux yeux est supérieure à 2 mm.","True","Le document indique : « Exophtalmie si > 21 mm ou si différence > 2 mm entre les deux yeux ».","Easy"
"Le scanner centré sur l’orbite est demandé en deuxième intention après l’IRM.","False","Le document précise : « Scanner centré sur l’orbite systématique et demandé en première intention ».","Easy"
"La compression du nerf optique dans l’exophtalmie expose à une atrophie optique irréversible.","True","Le document indique : « Risque d’atrophie optique irréversible ».","Easy"
"L’exophtalmie basedowienne est toujours bilatérale.","False","Le document précise : « NB : Basedow peut rester unilatérale ».","Easy"
"La fistule carotido-caverneuse est caractérisée par une exophtalmie non pulsatile.","False","Le document indique : « Fistule carotido-caverneuse : Exophtalmie pulsatile +++ ».","Easy"
"Le rhabdomyosarcome est une tumeur bénigne de l’enfant.","False","Le document précise : « Rhabdomyosarcome : tumeur musculaire striée, la plus fréquente des tumeurs malignes orbitaires de l’enfant ».","Easy"
"Le kyste dermoïde siège typiquement au niveau de l’angle supéro-externe de l’orbite.","True","Le document indique : « siège au niveau de l’angle supéro-externe de l’orbite (queue du sourcil) ».","Easy"
"Les varices orbitaires provoquent une exophtalmie fixe et indolore.","False","Le document précise : « Varices orbitaires : exophtalmie variable, en accordéon, augmente à l’effort, Valsalva ».","Easy"
"La radiothérapie orbitaire est indiquée en première intention dans toute exophtalmie.","False","Le document mentionne la radiothérapie uniquement « en cas d’exophtalmie maligne de Basedow ».","Easy"
"La myopie forte est un diagnostic différentiel de l’exophtalmie.","True","Le document liste : « Myopie forte (longueur axiale > 25-27 mm) » parmi les diagnostics différentiels.","Easy"
"L’exorbitisme correspond à une augmentation du volume orbitaire.","False","Le document indique : « Exorbitisme : protrusion par diminution du volume orbitaire ».","Easy"
"La buphtalmie est un glaucome congénital pouvant simuler une exophtalmie.","True","Le document cite « Buphtalmie par glaucome congénital » comme diagnostic différentiel.","Easy"
"Le fond d’œil peut montrer un œdème papillaire en cas de compression du nerf optique.","True","Le document indique : « Œdème papillaire = HTIC/ compression du nerf optique ».","Easy"
"La vitamine A pommade ophtalmique est utilisée pour lubrifier la cornée.","True","Le document précise : « Vitamine A pommade ophtalmique (régénère la cornée) » dans le traitement symptomatique.","Easy"
"La blépharorraphie est le traitement médical de première intention de l’exposition cornéenne.","False","Le document indique : « Blépharorraphie : si échec du traitement médical ». Le traitement médical de première intention est les larmes artificielles.","Easy"
"Le lymphome orbitaire touche préférentiellement l’enfant.","False","Le document précise : « Lymphome de l’orbite : Sujet âgé ».","Easy"
"Les métastases orbitaires peuvent révéler un cancer du poumon, du rein ou du sein.","True","Le document indique : « recherche primitive : cancers du poumon, du rein, du sein ».","Easy"
"La cellulite orbitaire est une urgence thérapeutique.","True","Le document précise : « traitement repose sur une hospitalisation avec antibiothérapie d’urgence ».","Easy"
"L’interrogatoire oriente le diagnostic étiologique dans 9 cas sur 10.","True","Le document indique : « Interrogatoire : Important, oriente dans 9/10 ».","Easy"
"Le kyste hydatique orbitaire est fréquent en France métropolitaine.","False","Le document précise : « Kyste hydatique exceptionnel (surtout en Afrique du Nord) ».","Easy"
"Le gliome du nerf optique évolue rapidement.","False","Le document indique : « Gliome du nerf optique : Evolution lente ».","Easy"
"Une exophtalmie axile est une protrusion du globe vers l’avant sans déviation.","True","Par opposition à l’exophtalmie oblique, l’axile est directe.","Easy"
"La dilatation des vaisseaux conjonctivaux en tête de méduse est évocatrice d’une fistule carotido-caverneuse.","True","Le document le mentionne explicitement.","Easy"
"Une exophtalmie unilatérale douloureuse avec fièvre évoque d’abord une tumeur.","False","Le document associe fièvre, douleur, inflammation à la cellulite orbitaire, pas aux tumeurs (sauf abcès).","Medium"
"Dans l’exophtalmie basedowienne, le scanner montre un amincissement des muscles oculo-moteurs.","False","Le document précise : « Scanner : épaississement des muscles oculo-moteurs ».","Medium"
"La thrombophlébite suppurée du sinus caverneux complique la fistule carotido-caverneuse.","False","Elle complique la cellulite orbitaire, avec 30% de décès.","Medium"
"Une exophtalmie réductible à la palpation est typique d’une tumeur maligne.","False","Le document associe réductibilité à la méningocèle et aux varices, jamais aux tumeurs malignes.","Medium"
"L’asynergie oculo-palpébrale est spécifique de l’exophtalmie basedowienne.","True","Le document le cite avec +++ dans Basedow.","Medium"
"L’exophtalmie par mucocèle nécessite un bilan ORL.","True","Le document précise : « Mucocèle du sinus frontal qui nécessite un bilan ORL ».","Medium"
"L’hémangiome caverneux de l’adulte est rapidement évolutif.","False","Le document indique : « Hémangiome caverneux de l’adulte, peu évolutif ».","Medium"
"Un souffle à l’auscultation orbitaire est pathognomonique d’une tumeur maligne.","False","Le document associe le souffle à la fistule carotido-caverneuse.","Medium"
"La radiographie standard du crâne est l’examen de première intention dans l’exophtalmie.","False","Le scanner est l’examen de première intention.","Medium"
"L’exophtalmie post-traumatique par hématome peut nécessiter une décompression.","True","Le document indique : « Décompression : si menace sur le nerf optique (hématome) ».","Medium"
"Le rhabdomyosarcome représente 5% des cancers pédiatriques.","True","Le document cite : « 5% des cancers PÉDIATRIQUES ».","Medium"
"La méningocèle orbitaire est une tumeur héréditaire.","False","Le document précise : « congénitale, non héréditaire ».","Medium"
"Le traitement d’une exophtalmie repose uniquement sur le traitement étiologique.","False","Le document décrit aussi un traitement symptomatique (protection oculaire, larmes artificielles).","Medium"
"L’exophtalmie basedowienne peut être associée à une diplopie.","True","Le document mentionne : « Parfois une diplopie ».","Medium"
"La ligne bicanthale au scanner permet de grader l’exophtalmie.","True","Le document indique : « Ligne bicanthale : 1/3 postérieur du globe derrière la ligne, Grade de l’exophtalmie ».","Medium"
"L’exophtalmie par varices orbitaires est augmentée par le décubitus dorsal.","False","Le document précise « tête en bas », donc décubitus ventral ou proclive.","Medium"
"Le traitement de la cellulite orbitaire repose sur une antibiothérapie probabiliste en ambulatoire.","False","Le document insiste sur l’hospitalisation et l’urgence.","Medium"
"La rétraction palpélaire est un diagnostic différentiel de l’exophtalmie.","True","Le document liste : « Rétraction palpébrale (cicatrice de brûlure, Basedow) ».","Medium"
"L’exophtalmie unilatérale chez l’enfant est toujours en rapport avec un kyste dermoïde.","False","De nombreuses étiologies existent : rhabdomyosarcome, gliome, méningocèle, etc.","Medium"
"L’IRM orbitaire peut être indiquée en complément du scanner.","True","Le document indique : « Et/ou IRM en complément du scanner ».","Medium"
"Une exophtalmie unilatérale avec atrophie optique chez l’enfant évoque un gliome du nerf optique.","True","Le document indique : « Unilatérale, axiale, associée à une atrophie optique » pour le gliome.","Medium"
"Le kyste dermoïde provoque toujours une exophtalmie majeure.","False","Le document précise : « L’exophtalmie est rare » pour le kyste dermoïde.","Medium"
"La décompression orbitaire est indiquée en cas de risque de compression du nerf optique par un hématome.","True","Document : « Décompression : si menace sur le nerf optique (hématome) ».","Medium"
"Le lymphome orbitaire nécessite une biopsie pour le diagnostic.","True","Document : « Le diagnostic est histologique par biopsie ».","Medium"
"Un patient avec exophtalmie bilatérale, rétraction palpébrale et asynergie oculo-palpébrale a très probablement une maladie de Horton.","False","C’est le tableau typique de la maladie de Basedow, pas de Horton.","Difficult"
"Une exophtalmie rapidement progressive chez un enfant doit faire suspecter un kyste dermoïde.","False","Le kyste dermoïde est présent dès la naissance et stable ; le rhabdomyosarcome est rapidement évolutif.","Difficult"
"La fistule carotido-caverneuse est toujours traumatique.","False","Le document cite aussi « AVC, HTA ».","Difficult"
"L’adénome pléomorphe de la glande lacrymale n’a aucun potentiel malin.","False","Le document précise : « possèdent un potentiel évolutif malin vers le carcinome ».","Difficult"
"L’exophtalmie basedowienne maligne justifie une radiothérapie orbitaire.","True","Document : « Radiothérapie orbitaire en cas d’exophtalmie maligne de Basedow ».","Difficult"
"La méningocèle est toujours associée à un défect osseux visible à la radiographie.","True","Document : « Radiographie : défect osseux (absence d’os) ».","Difficult"
"Les varices orbitaires sont une urgence chirurgicale systématique.","False","Le document ne mentionne aucune urgence pour les varices, contrairement à la fistule ou à l’hématome.","Difficult"