"question","answer","explanation","difficulty"
"Expliquez pourquoi le lobe droit du foie est trois fois plus touché que le lobe gauche dans les abcès pyogéniques, en vous basant uniquement sur le document (même si le document ne donne pas la raison, utilisez les données disponibles).","Le document ne fournit pas d’explication mécanistique, mais on peut relier les voies d’envahissement : le système porte draine la majeure partie de l’intestin vers le lobe droit, et les infections biliaires ou les septicémies par l’artère hépatique peuvent également prédominer à droite. Cependant, la réponse stricte selon le document est que le lobe droit est 3 fois plus touché (constat factuel).","Le document indique : ""Abcès pyogénique : le lobe droit est 3 fois plus touché que le lobe gauche"". Aucune explication supplémentaire n’est donnée.","Medium"
"À partir des symptômes primaires listés (fièvre, malaise, frisson, anorexie, perte de poids, douleur abdominale, nausée), quel mécanisme physiopathologique commun peut expliquer leur présence ?","Ces symptômes sont aspécifiques et reflètent la réponse inflammatoire systémique à l’infection du parenchyme hépatique. La fièvre, les frissons et le malaise sont liés à la libération de cytokines ; l’anorexie, la perte de poids et les nausées sont des conséquences métaboliques et digestives de l’inflammation hépatique ; la douleur abdominale est due à la distension de la capsule de Glisson.","Le document souligne que les signes cliniques sont aspécifiques. La réponse attendue est une synthèse logique, mais strictement basée sur les données du document (qui ne détaille pas les mécanismes). Le document dit : ""Les symptômes primaires sont : fièvre, malaise, frisson, anorexie, perte de poids, douleur abdominale, nausée"".","Medium"
"Comparez les modalités de drainage entre abcès pyogénique et abcès amibien selon le document.","Pour l’abcès pyogénique, le drainage (percutané ou chirurgical) est systématique et associé à l’antibiothérapie. Pour l’abcès amibien non compliqué, le traitement est médical (amoebicides) et non chirurgical ; un drainage n’est pas mentionné sauf en cas de complication (rupture ou surinfection).","Le document : ""traitement standard des abcès pyogéniques sont basés sur le drainage externe associé à une antibiothérapie"" ; ""Le traitement d’un abcès amibien non-compliqué est a priori non-chirurgical"" et ""S’il n’y a pas de rupture ni d’infection secondaire : les amoebicides sont le traitement de choix"".","Medium"
"Quels arguments du document permettent d’affirmer que le diagnostic d’abcès hépatique est un défi ?","Le document donne trois arguments : (1) les signes cliniques sont aspécifiques, (2) la différenciation précoce entre abcès pyogénique et amibien est difficile en raison de similarités des signes, symptômes et aspects radiologiques, (3) les symptômes primaires (fièvre, douleur, etc.) sont communs à de nombreuses pathologies.","Le document : ""Le diagnostic d’abcès hépatique est un défi"" ; ""Les signes cliniques sont aspécifiques"" ; ""La différenciation précoce entre abcès pyogénique et abcès amibien est difficile : Similarité des signes, Similarité des symptômes, Similarité des aspects radiologiques"".","Medium"
"Expliquez le rôle de l’antibiogramme dans la prise en charge des abcès pyogéniques selon le document.","L’antibiogramme permet de corriger le schéma thérapeutique initial (aminoglycoside + anti‑anaérobie + pénicilline) après identification des germes. Le document insiste sur le fait que le schéma de base est adapté en fonction du résultat de l’antibiogramme.","Le document : ""Le schéma thérapeutique = aminoglycoside + antibiotique contre les germes anaérobies + pénicilline. Corrigé par le résultat de l’antibiogramme"".","Medium"
"Pourquoi le traitement d’un abcès pyogénique nécessite-t-il un délai d’antibiothérapie de 1 à 2 jours avant le drainage ?","Le document ne donne pas explicitement la raison, mais on peut déduire que ce délai permet de réduire la charge bactérienne, de limiter le risque de dissémination septique lors du drainage, et de stabiliser le patient. Cependant, la réponse stricte se limite à citer le délai.","Le document indique : ""Respecter un délai de 1 à 2 jours d’antibiothérapie avant le drainage"". Aucune explication causale n’est fournie.","Medium"
"À partir des voies d’envahissement listées, expliquez comment un traumatisme abdominal peut conduire à un abcès hépatique.","Le document mentionne ""d’une effraction directe par traumatisme"". Un traumatisme peut provoquer une rupture de la capsule hépatique ou une lésion parenchymateuse, permettant aux germes de la peau, du tube digestif ou de l’environnement de pénétrer directement dans le foie et d’y former un abcès.","Le document cite : ""d’une effraction directe par traumatisme"" comme voie d’envahissement.","Medium"
"Quelle est la signification pronostique de l’absence de surinfection dans l’abcès amibien, d’après le document ?","L’absence de surinfection est associée à une faible mortalité si les recommandations sont suivies. La surinfection (probablement par des bactéries pyogéniques) aggrave le pronostic et nécessite probablement une prise en charge différente (ajout d’antibiotiques ou drainage).","Le document : ""La mortalité est faible si on suit les recommandations et s’il n’y a pas de surinfection"".","Difficult"
"En vous basant sur le document, expliquez pourquoi l’échographie est plus utile en première intention que le scanner malgré une sensibilité inférieure.","L’échographie a une sensibilité élevée (85‑95%) et est largement disponible, non irradiante, moins coûteuse et permet une biopsie échoguidée. Le scanner, bien que plus sensible (95‑100%), est souvent réservé pour un bilan plus précis ou une intervention thérapeutique. Le document dit que l’échographie est ""l’examen le plus utile en première intention"".","Le document : ""Echographie : c’est l’examen le plus utile en première intention pour détecter les abcès du foie. Haute sensibilité (85-95%) [...] Permet une biopsie échoguidée"" et ""Scanner abdominale : c’est la plus sensible (95% à 100%). Il permet aussi bien le diagnostic qu’une intervention thérapeutique"".","Difficult"
"Un patient avec un abcès amibien reçoit du métronidazole per os. Au bout de 48 heures, il n’y a pas d’amélioration. Quelle conduite est suggérée par le document ?","Le document ne prévoit pas explicitement d’échec, mais il indique que la réponse clinique est appréciée par la disparition de la douleur, de la fièvre et de l’hyperleucocytose. Si aucune amélioration, il faut suspecter une surinfection (nécessitant une antibiothérapie) ou un abcès pyogénique, ou vérifier l’observance. On pourrait aussi passer à la voie veineuse si le patient est trop faible. Cependant, la réponse doit rester prudente.","Le document mentionne : ""Si le malade est trop faible, administration veineuse"" et ""s’il n’y a pas de surinfection"". Un échec peut indiquer une surinfection ou une mauvaise absorption.","Difficult"
"Quels sont les germes aérobies les plus fréquemment rencontrés dans les abcès pyogéniques selon le document ?","Escherichia coli, Klebsiella, entérocoque.","Le document : ""Germes les plus rencontrés : Escherichia coli, Klebsiella, entérocoque""","Easy"
"Quelle est la différence de prise en charge entre un abcès pyogénique accessible par voie percutanée et un abcès non accessible ?","Le drainage percutané est préféré si accessible ; sinon, une intervention chirurgicale est nécessaire. Le document dit que le choix dépend de l’accessibilité, du nombre, du volume et du traitement de la cause sous‑jacente.","Le document : ""Le drainage peut être fait par voie percutanée ou par intervention chirurgicale (dépend de l’accessibilité de l’abcès, nombre et volume, traitement de la cause sous-jacente)""","Medium"
"Quel est le mécanisme de formation de la cavité dans l’abcès amibien ?","La zone de destruction se fusionne pour créer une cavité large, habituellement dans le lobe droit.","Le document : ""La zone de destruction se fusionne => cavité large dans le lobe droit""","Easy"
"Quel est le rôle de la scintigraphie au Technétium dans le diagnostic des abcès hépatiques ?","Elle est citée comme une autre technique sensible, mais moins précise que le scanner et l’échographie.","Le document : ""Autres techniques : scintigraphie au Technétium (sensible), IRM""","Easy"
"Pourquoi l’incidence des abcès du foie est‑elle élevée dans les pays où les soins ne sont pas immédiatement disponibles ?","Parce que les infections sous‑jacentes (amibiase intestinale, infections biliaires, septicémies) ne sont pas traitées précocement, permettant la dissémination et la formation d’abcès.","Le document : ""Incidence élevée dans les pays où les soins ne sont pas immédiatement disponibles"". L’explication est logique mais non détaillée.","Medium"
"Quelles sont les deux complications mortelles possibles d’un abcès pyogénique non traité ?","Septicémie et rupture, ou les deux associées.","Le document : ""Par septicémie, rupture ou les deux""","Easy"
"Quel est le traitement indiqué si un abcès amibien se complique d’une rupture ?","Le document ne le dit pas explicitement, mais la rupture nécessite probablement un drainage chirurgical et une antibiothérapie. Pour rester strict, on répond : le document ne mentionne pas de traitement spécifique pour la rupture, mais dit que l’abcès amibien non compliqué est traité par amoebicides.","Le document : ""S’il n’y a pas de rupture ni d’infection secondaire : les amoebicides sont le traitement de choix"". Par déduction, en cas de rupture, le traitement n’est plus uniquement médical.","Difficult"
"Quelle est la durée recommandée du traitement par métronidazole pour un abcès amibien ?","Une à deux semaines, à raison de 750 mg trois fois par jour.","Le document : ""Dose = 750 mg, trois fois par jour pendant une à deux semaines""","Easy"
"Quels sont les deux éléments principaux qui rendent le foie vulnérable aux abcès ?","Le document n’énumère que la présence des germes et la vulnérabilité du foie comme deux éléments, mais ne détaille pas les causes de vulnérabilité. On peut répondre : la vulnérabilité du foie est liée à son double apport sanguin (porte et artériel) et à sa fonction de filtre.","Le document : ""La physiopathologie [...] met en jeu deux éléments principaux : 1. La présence des germes en cause 2. La vulnérabilité du foie"".","Medium"
"Comment le document définit‑il l’abcès amibien ?","Il s’agit d’un abcès qui provient de l’amibiase intestinale (Entamoeba histolytica).","Le document : ""Abcès amibiase (provient de l’amibiase intestinale : e.h.h)""","Easy"