"question","option1","option2","option3","option4","answer","explanation","difficulty"
"Quelle est la localisation anatomique des corps étrangers laryngo-trachéo-bronchiques ?","Voies aériennes supérieures","Voies aériennes inférieures","Œsophage","Pharynx","2","Le document définit : ''Enclavement d''un corps étranger dans les voies aériennes inférieures''","Easy"
"Quelle est la tranche d''âge la plus touchée par les corps étrangers des VAI ?","Nourrissons de 0-6 mois","Enfants de 1 à 4 ans","Enfants de 5 à 10 ans","Adultes de 30-50 ans","2","Le document indique : ''Enfant de 1 à 4 ans avec prédominance masculine''","Easy"
"Quel est le principal facteur de risque chez l''adulte de plus de 70 ans ?","Troubles neurologiques","Tabagisme","Éthylisme","Reflux gastro-œsophagien","1","Le document précise : ''Adulte de plus de 70 ans, dû à des troubles neurologiques''","Easy"
"Quelle est la manœuvre d''expulsion chez l''adulte ?","Manoeuvre de Mofenson","Manoeuvre de Heimlich","Compression abdominale chez l''enfant","Trachéotomie","2","Le document mentionne : ''Manoeuvre de Heimlich (adulte) et de Mofenson (enfant)''","Easy"
"Quel est le traitement de référence des corps étrangers des VAI ?","Extraction digitale","Trachéotomie","Extraction endoscopique au tube rigide sous AG","Manoeuvre de Heimlich","3","Le document indique : ''Traitement de référence : extraction endoscopique au tube rigide S/AG''","Easy"
"Quel signe auscultatoire est évocateur d''un corps étranger trachéal ?","Râles crépitants","Bruit de drapeau","Souffle tubaire","Frottement pleural","2","Le document précise : ''Auscultation de la trachée : "bruit de drapeau"''","Easy"
"Quels sont les deux signes pathognomoniques des angines ?","Fièvre et céphalées","Odynophagie et fièvre","Dysphagie et hypersialorrhée","Toux et dyspnée","2","Le document indique : ''"maux de gorge sans fièvre n''est jamais angine. Angine = odynophagie + fièvre"''","Easy"
"Quelle angine est considérée comme le tableau de diagnostic positif de référence ?","Angine érythémateuse","Angine érythémato-pultacée","Angine vésiculeuse","Mononucléose infectieuse","2","Le document précise : ''TDD : Angine érythémato-pultacée (AEP)''","Easy"
"Quel est l''agent pathogène recherché par le TDR SBHA ?","Virus EBV","Streptocoque béta-hémolytique du groupe A","Pneumocoque","Corynebacterium diphtheriae","2","Le document indique : ''TDR SBHA : positif'' ; SBHA = Streptocoque Bêta-Hémolytique du groupe A","Easy"
"Quelle complication rhumatologique peut survenir après une angine non traitée ?","Polyarthrite rhumatoïde","Rhumatisme articulaire aigu","Lupus érythémateux","Goutte","2","Le document liste : ''Rhumatisme articulaire aiguë (RAA)'' comme complication","Easy"
"Quelle est la première cause d''automédication à Madagascar ?","Paludisme","Angine","Diarrhée","Hypertension","2","Le document indique : ''Première cause d''automédication'' pour les angines","Easy"
"Quel signe clinique oriente vers une angine de Vincent ?","Ulcération amygdalienne bilatérale","Fausses membranes extensives","Vésicules du voile du palais","Hypertrophie unilatérale","1","Le document précise : ''Angine de Vincent : ulcération amygdalienne bilatérale''","Easy"
"Quelle est la particularité anatomique du larynx chez l''enfant favorisant les corps étrangers ?","Dimensions plus grandes","Innervation moins riche","Dimensions inférieures et situation plus haute et verticale","Cartilage plus épais","3","Le document mentionne : ''Dimensions nettement inférieures, Situation plus haute et plus verticale''","Easy"
"Quelle manœuvre est formellement interdite dans la prise en charge d''un corps étranger des VAI ?","Endoscopie","Trachéotomie","Extraction digitale","Manoeuvre de Heimlich","3","Le document indique : ''Toute tentative d''extraction digitale est formellement interdite''","Easy"
"Quelle est la proportion des angines d''origine virale ?","80%","50%","30%","20%","1","Le document précise : ''Causes virales (80%)''","Easy"
"Quel est le traitement de première intention des angines bactériennes ?","Macrolides","Pénicilline ou amoxicilline-acide clavulanique","Aminoglycosides","Fluoroquinolones","2","Le document indique : ''Première intention : pénicilline ou association amoxicilline acide clavulanique''","Easy"
"Quel est l''âge minimum recommandé pour la tonsillectomie ?","2 ans","4 ans","6 ans","8 ans","3","Le document précise : ''Âge > 6 ans (avant 6 ans : maladies d''adaptation)''","Easy"
"Quelle angine est causée par le virus d''Epstein-Barr ?","Angine herpétique","Angine érythémateuse","Mononucléose infectieuse","Angine vésiculeuse","3","Le document associe EBV à la MNI","Easy"
"Quel type de corps étranger est le plus dangereux par gonflement obstructif ?","Cacahuète","Pièce de monnaie","Punaise","Perle","1","Le document précise : ''cacahuète +++ (lena dia migonfle -> obstructif -> asphyxie)''","Easy"
"Quel est le signe clinique évocateur d''un corps étranger laryngé ?","Toux coqueluchoïde","Bruit de drapeau","Voix éteinte avec toux rauque","Polypnée sifflante","3","Le document indique : ''Dyspnée avec tirage, cornage, toux rauque, voix éteinte''","Easy"
"Quelle est la définition d''une angine à répétition selon le document ?","3 épisodes par an","4 épisodes par an pendant 2 années successives","5 épisodes en 6 mois","6 épisodes par an","2","Le document précise : ''Angine à répétition (Mada : au moins 4 épisodes d''angine par an 2 années successives)''","Easy"
"Quel examen n''a pas de place dans le diagnostic de l''angine érythémato-pultacée ?","NFS","CRP","TDR SBHA","Imagerie","4","Le document indique : ''Imagerie : pas de place dans le diagnostic de l''AEP''","Easy"
"Pourquoi les AINS sont-ils contre-indiqués dans les angines ?","Risque de cellulite","Risque hémorragique","Risque de nécrose","Risque d''allergie","1","Le document précise : ''Eviter les AINS : (risque de cellulite)''","Medium"
"Expliquez le mécanisme par lequel une cacahuète est particulièrement dangereuse comme corps étranger bronchique.","La cacahuète est un corps étranger végétal qui a tendance à s''hydrater, gonfler et se fragmenter dans l''arbre bronchique, ce qui augmente l''obstruction et complique l''extraction.","Le document mentionne : ''Risque d''hydratation, de gonflement et de fragmentation'' pour les CE végétaux comme la cacahuète.","Medium"
"Pourquoi les enfants de 1 à 4 ans sont-ils prédisposés aux corps étrangers des VAI ?","En raison de dimensions laryngées inférieures, d''une situation laryngée plus haute et verticale, et d''une innervation très riche favorisant les laryngospasmes.","Le document liste ces trois particularités anatomiques et physiologiques chez l''enfant.","Medium"
"Quelle est la différence entre un syndrome de pénétration évident et un syndrome passé inaperçu ?","Le syndrome évident est observé par un témoin avec accès de suffocation brutale. Le syndrome inaperçu est le plus fréquent, sans témoin, avec des signes discrets (toux rebelle, polypnée sifflante) pouvant évoluer 2 semaines à 3 mois.","Le document distingue clairement ces deux présentations cliniques.","Medium"
"Quels sont les signes radiologiques indirects d''un corps étranger bronchique obstructif radio-transparent ?","Atélectasie, emphysème obstructif, refoulement médiastinal. Au stade de complication : image d''abcès pulmonaire ou de pneumopathies récidivantes.","Le document liste ces signes indirects pour les CE radio-transparents obstructifs.","Medium"
"Pourquoi la dyspnée d''une laryngite aiguë est-elle un diagnostic différentiel important du corps étranger laryngé ?","La laryngite aiguë donne une dyspnée laryngée similaire mais dans un contexte infectieux fébrile, sans syndrome de pénétration. La recherche du syndrome de pénétration est donc essentielle.","Le document mentionne la laryngite aiguë comme diagnostic différentiel et insiste sur la recherche du syndrome de pénétration.","Medium"
"Quel est le risque vital spécifique d''un corps étranger laryngé par rapport à un corps étranger bronchique ?","Le CE laryngé (surtout sous-glottique) expose à un risque élevé de mort subite par asphyxie aiguë, alors que le CE bronchique est mieux toléré et peut évoluer plusieurs semaines.","Le document précise pour le CE laryngé : ''risque élevé de mort subite'' et pour le CE bronchique : ''bonne tolérance (peut aller de 2 semaines à 3 mois)''.","Medium"
"Quelles sont les fausses membranes de la diphtérie et comment se distinguent-elles de celles de la MNI ?","Les fausses membranes de la diphtérie sont adhérentes, extensives à l''uvule, avec fièvre modérée (<38°C). Celles de la MNI sont limitées aux tonsilles, non extensives, avec fièvre, rash cutané et splénomégalie.","Le document décrit les spécificités de chaque angine à fausses membranes.","Medium"
"Pourquoi les bêtalactamines sont-elles contre-indiquées dans la mononucléose infectieuse ?","L''administration de bêtalactamines (comme l''amoxicilline) au cours de la MNI déclenche un rash cutané maculo-papuleux dans plus de 90% des cas, souvent confondu avec une allergie médicamenteuse.","Le document indique : ''Ne pas utiliser des bêtalactamines si MNI'' – l''explication est clinique.","Medium"
"Quel est l''intérêt du prélèvement de gorge systématique devant toute angine ?","Le prélèvement permet d''identifier le Streptocoque bêta-hémolytique du groupe A, principale cause bactérienne (20-30%), et d''adapter l''antibiothérapie. Il permet aussi de détecter l''association fuso-spirillaire de l''angine de Vincent.","Le document mentionne le prélèvement comme systématique et le SBHA comme cible principale.","Medium"
"Pourquoi l''angine ulcéro-nécrotique doit-elle faire rechercher une hémopathie maligne ?","Une angine ulcéro-nécrotique unilatérale ou bilatérale traînante peut être révélatrice d''une leucémie ou d''un lymphome, car ces pathologies altèrent l''immunité locale et favorisent les infections nécrosantes.","Le document indique : ''Toujours rechercher une hémopathie maligne''.","Medium"
"Quelle est la différence de prise en charge entre un CE radio-opaque et un CE radio-transparent ?","Le CE radio-opaque est diagnostiqué directement sur la radiographie. Le CE radio-transparent nécessite des signes indirects (atélectasie, emphysème, refoulement médiastinal) et une forte suspicion clinique basée sur l''interrogatoire.","Le document distingue les deux situations.","Medium"
"Pourquoi les complications post-opératoires après extraction de CE des VAI sont-elles exceptionnelles mais incluent le laryngospasme ?","Le laryngospasme est un réflexe de fermeture glottique induit par la manipulation du larynx lors de l''endoscopie. L''AG et les soins per-opératoires le réduisent mais ne l''éliminent pas complètement.","Le document liste le laryngospasme comme complication post-opératoire.","Medium"
"Quels sont les trois diagnostics différentiels principaux des corps étrangers des VAI ?","Corps étranger œsophagien (à éliminer par radiographie pulmonaire de profil), laryngite aiguë (contexte infectieux), et toutes les pathologies broncho-pulmonaires (asthme, pneumonie).","Le document liste ces trois catégories de diagnostics différentiels.","Medium"
"Pourquoi la survenue d''un accès de suffocation brutale chez un enfant impose-t-elle une endoscopie bronchique même si les symptômes régressent ?","Le CE a pu migrer d''une bronche souche vers une bronche de plus petit calibre, ou se fragmenter. L''endoscopie permet à la fois de diagnostiquer et d''extraire le CE avant qu''il ne provoque une atelectasie ou un abcès.","Le document précise : ''Impose une endoscopie bronchique en urgence même si les symptômes régressent (à visée diagnostique et thérapeutique)''.","Medium"
"Expliquez la phrase : ''Tsy asaina miteny hoe "aaaaaa", tsy avoaka ny lela fa tsindriana moramora amin''ny abaisse-langue fotsiny'' pour l''examen des angines.","Ne pas demander de dire ''aaa'' car cela contracte les muscles du pharynx et cache les tonsilles. Il faut simplement appuyer doucement sur la langue avec l''abaisse-langue pour exposer les tonsilles au repos.","Le document contient cette instruction en malgache ; elle est fondamentale pour un examen ORL correct.","Medium"
"Quelle est la présentation clinique de l''angine herpétique ?","Début brutal avec fièvre et dysphagie intense, vésicules limitées au niveau du voile du palais (contrairement à l''herpangine diffuse des mains et pieds). Virus herpétique en cause.","Le document décrit l''angine vésiculeuse avec deux sous-types.","Medium"
"Un enfant de 3 ans présente une toux rebelle depuis 3 semaines, sans fièvre, avec une polypnée sifflante. L''examen trouve une asymétrie de ventilation. Aucun témoin n''a assisté à une crise de suffocation. Quel diagnostic évoquer ?","CE bronchique avec syndrome de pénétration passé inaperçu (cas le plus fréquent). Le CE est probablement bloqué dans une bronche souche avec bonne tolérance.","Le document décrit exactement ce tableau : ''Cas le plus fréquent, aucun témoin... Signes cliniques discrets''.","Difficult"
"Une patiente de 25 ans présente une angine avec fausses membranes limitées aux tonsilles, un rash cutané, une splénomégalie, une polyadénopathie cervicale. La sérologie EBV est positive. Pourquoi ne pas prescrire d''amoxicilline ?","Il s''agit d''une mononucléose infectieuse. L''amoxicilline déclencherait un rash cutané dans plus de 90% des cas, simulant une allergie et compliquant la prise en charge. Le traitement est symptomatique.","Le document associe EBV à la MNI et déconseille les bêtalactamines.","Difficult"
"Un patient de 70 ans, avec antécédent d''AVC séquellaire, présente une dyspnée d''apparition brutale avec tirage et cornage. La radiographie est normale. Le syndrome de pénétration est incertain. Quel diagnostic prioritaire et quelle conduite ?","CE laryngé sous-glottique (risque élevé de mort subite). Conduite : endoscopie bronchique en urgence (diagnostique et thérapeutique). La radiographie normale n''élimine pas un CE radio-transparent. Les troubles neurologiques sont un facteur favorisant.","Le document mentionne adulte >70 ans avec troubles neurologiques, CE laryngé avec risque de mort subite, et CE radio-transparent possible.","Difficult"
"Un enfant de 4 ans a ingéré une cacahuète il y a 3 jours, asymptomatique depuis. La radiographie est normale. L''auscultation trouve un wheezing expiratoire localisé. Quelle est la prise en charge ?","Endoscopie bronchique sous AG en urgence. La cacahuète est un CE végétal qui va gonfler et se fragmenter, risquant une obstruction complète. Le wheezing signe un emphysème obstructif localisé, signe indirect de CE.","Le document souligne le risque de gonflement de la cacahuète et la nécessité d''endoscopie même si les symptômes ont régressé.","Difficult"
"Un patient présente depuis 3 mois une toux chronique et des pneumopathies récidivantes du lobe inférieur droit, traitées par antibiotiques avec amélioration temporaire. Aucune cause infectieuse retrouvée. Quelle hypothèse et quel examen ?","Hypothèse : corps étranger bronchique méconnu (diagnostic retardé). Examen : endoscopie bronchique au tube rigide sous AG, à la fois diagnostique et thérapeutique.","Le document décrit : ''Tableau de pathologie infectieuse broncho-pulmonaire traînante et récidivante'' en cas de diagnostic méconnu.","Difficult"
"Un patient avec une angine érythémato-pultacée non traitée développe une dysphagie unilatérale intense, une voix nasonnée, une trismus et une déviation de la luette. Quel diagnostic et quelle prise en charge ?","Phlegmon péri-tonsillaire (complication de l''angine non traitée). Prise en charge : drainage chirurgical (incision-évacuation), antibiothérapie, parfois tonsillectomie secondaire si récidive.","Le document liste le phlegmon péri-tonsillaire comme complication de l''angine non traitée.","Difficult"