question,answer,explanation,difficulty
"Décrivez les quatre objectifs pédagogiques de l’apprentissage sur l’otite externe selon le document.",Les quatre objectifs sont : 1) Définir l’otite externe, 2) Diagnostiquer une otite externe, 3) Citer les déterminants d’une otite externe, 4) Décrire les stratégies thérapeutiques. Ces objectifs couvrent la définition, le diagnostic clinique (car le diagnostic est clinique), l’étiologie et les facteurs favorisants, et enfin la prise en charge thérapeutique (soulagement, lutte anti-infectieuse, prévention). Le document insiste sur la prévention car l’otite externe est une maladie auto-infligée évitable.,Le document liste les objectifs en introduction.","Easy"
"Expliquez pourquoi l’otite externe est qualifiée de maladie auto-infligée évitable.",L’otite externe est qualifiée de maladie auto-infligée car elle est le plus souvent secondaire à des manipulations intempestives du conduit auditif externe (coton-tiges, plumes d’oiseau, grattage) qui créent des micro-lésions cutanées, perturbent le cérumen (rôle protecteur) et permettent la pénétration des germes. Elle est évitable car des mesures simples de prévention suffisent : ne pas introduire d’objet dans l’oreille, ne pas se gratter, protéger l’oreille lors des baignades, éviter les piscines non traitées. Le document conclut : OE : maladie auto-infligée, EVITABLE. Prévention++++.,Le document le mentionne dans l’introduction (FDR : lésion cutanée du MAE (grattage) ; affection pouvant être prévenue) et dans la conclusion.","Easy"
"Quels sont les trois types d’agents infectieux responsables de l’otite externe ?",Les trois types d’agents infectieux sont : bactériens (Staphylococcus aureus, Staphylococcus epidermidis, entérobactéries, Pseudomonas aeruginosa), mycosiques (champignons : Aspergillus, Candida) et viraux. L’otite externe est secondaire à une perturbation du rôle protecteur du cérumen, permettant à ces agents de proliférer dans la peau du méat acoustique externe. Le document précise : d’origine bactérienne, mycosique ou virale. Le diagnostic différentiel entre ces formes se fait cliniquement (prurit évocateur de mycose, otorrhée fétide verdâtre de Pseudomonas dans la forme maligne).,Le document mentionne les trois types d’agents infectieux.","Medium"
"Comparez l’otalgie de l’otite externe diffuse et celle du furoncle du MAE.",L’otalgie de l’otite externe diffuse est intense, paroxystique, insomniante, exacerbée par la mastication, la pression du tragus et la traction de l’auricule, avec irradiation vers la tempe et la mandibule. L’otalgie du furoncle du MAE est identique dans sa présentation clinique à celle de la forme diffuse, mais elle se calme après l’ouverture spontanée ou chirurgicale du furoncle (évacuation du pus). Dans les deux formes, l’otoscopie est douloureuse et le MAE peut être sténosé. Le document indique que l’otalgie du furoncle est identique mais calmée par l’ouverture du furoncle.,Le document décrit les deux formes.","Medium"
"Un patient de 70 ans, diabétique déséquilibré, consulte pour une otalgie intense, une otorrhée fétide verdâtre, une paralysie faciale droite. Quel est le diagnostic et quelle est la prise en charge urgente ?",Le diagnostic est une otite externe maligne (nécrosante) à Pseudomonas aeruginosa sur terrain immunodéprimé (diabète déséquilibré). La paralysie faciale est un signe de mauvais pronostic. La prise en charge urgente comprend : 1) Hospitalisation, 2) Antibiothérapie IV (céphalosporine anti-pseudomonas + fluoroquinolone ou bithérapie adaptée) pendant 8 semaines, 3) Prélèvement bactériologique, 4) Scanner du rocher ou IRM pour évaluer l’extension (ostéite de la base du crâne), 5) Traitement du diabète (équilibre glycémique), 6) Soins locaux (détersion, calibrage), 7) Antalgiques, 8) Chirurgie possible (évidement pétromastoïdien) si échec médical. Le document précise : OE maligne : hospitalisation, ATB IV 8 semaines, traiter le FDR, chirurgie si besoin.,Le document décrit l’OE maligne, sa présentation et sa prise en charge.","Difficult"
"Expliquez la séquence évolutive de l’otite externe maligne depuis l’effraction cutanée jusqu’à l’ostéite de la base du crâne.",La séquence évolutive est : 1) Effraction cutanée (souvent après extraction d’un bouchon de cérumen ou lavage d’oreille) → 2) Cellulite du méat acoustique externe (infection des tissus mous) → 3) Chondrite du MAE (infection du cartilage, risque de nécrose) → 4) Ostéite du tympanal (atteinte de l’os du conduit auditif) → 5) Ostéite de la base du crâne (extension progressive vers la mastoïde, le rocher, et la base du crâne). Cette progression explique la gravité : paralysie des paires crâniennes (notamment le facial, VII), atteinte méningée, abcès cérébral. Le diagnostic précoce et l’antibiothérapie IV prolongée (8 semaines) sont essentiels pour bloquer cette cascade.,Le document détaille cette séquence : Effraction cutanée → Cellulite du MAE → Chondrite du MAE → Ostéite du tympanal → Ostéite de la base du crane.","Difficult"
"Quels sont les diagnostics différentiels de l’otalgie avec sténose du MAE et comment les éliminer ?",Les diagnostics différentiels cités sont : otite moyenne aiguë (tympan inflammatoire, absence de douleur à la traction du pavillon), otite moyenne chronique (perforation tympanique, antécédents), tumeur de l’oreille externe ou moyenne (aspect tumorale, biopsie), sténose du MAE congénitale ou acquise (absence d’inflammation), otohématome (antécédent de traumatisme, tuméfaction violacée), otalgie réflexe (douleur projetée d’un autre organe : dent, articulation temporo-mandibulaire, pharynx, larynx). L’examen clinique (otoscopie, pression du tragus) et l’interrogatoire permettent le plus souvent de différencier ces causes.,Le document liste ces diagnostics différentiels.","Medium"
"Pourquoi l’otite externe est-elle plus grave chez le patient diabétique ?",Le diabète déséquilibré favorise l’immunodépression (altération de la phagocytose, microangiopathie, neuropathie). Chez le patient diabétique, une simple otite externe peut évoluer vers une forme maligne (nécrosante) à Pseudomonas aeruginosa, avec extension aux tissus profonds : chondrite, ostéite du tympanal, puis ostéite de la base du crâne. Les complications sont graves : paralysie faciale, méningite, septicémie. De plus, le diabète retarde la cicatrisation et favorise les récidives. Le document précise : 90% des otites externes malignes surviennent chez le sujet âgé diabétique mal équilibré. Le traitement du diabète fait partie intégrante de la prise en charge de l’OE maligne (traiter le FDR).,Le document mentionne le diabète comme FDR principal de l’OE maligne.","Medium"
"Décrivez les signes otoscopiques des différentes formes d’otite externe.",Otite externe diffuse : otoscopie difficile voire impossible (douleur, sténose), tympan normal ou myringite associée. Furoncle du MAE : tuméfaction érythémateuse limitée centrée par un point blanc au début, puis masse mollasse, après rupture cratère rouge. Otite externe maligne : sténose du MAE, zone nécrotique ou lésion polypoïde. Otite externe mycosique (otomycose) : MAE inflammatoire, aspect humide de papier buvard, filaments blanchâtres cotonneux, parfois plages noirâtres charbonneuses. Otite externe chronique : comblement du MAE par débris boueux noirâtre ou blanchâtre, substance granulaire ou filamenteuse. Eczéma du MAE : érythème, vésicule, croûtes.,Le document décrit chaque forme avec ses caractéristiques otoscopiques.","Medium"
"Quels sont les facteurs favorisants et les facteurs déterminants (germes) de l’otite externe ?",Facteurs favorisants (conditions locales) : lésion cutanée préexistante du MAE (grattage), corps étranger, bain en piscine (eau contaminée), manipulations intempestives (coton-tiges, plumes d’oiseau). Facteurs déterminants (agents infectieux) : bactéries (Staphylococcus aureus, Staphylococcus epidermidis, entérobactéries, Pseudomonas aeruginosa), champignons (Aspergillus, Candida). Le document insiste sur le rôle protecteur du cérumen ; toute altération de cette barrière favorise l’infection. La connaissance de ces facteurs est essentielle pour la prévention (éviter les manipulations).,Le document liste les FDR et les germes.","Medium"
"Quelle est la place des traitements locaux et généraux dans l’otite externe diffuse ?",Dans l’otite externe diffuse, le traitement associe : 1) Soins locaux (détersion du MAE, pansement expansible dit calibrage = pope). 2) Traitements locaux médicamenteux : corticoïdes locaux (Polydexa, Antibiosynalar, Panotile) associés ou non à des antibiotiques locaux. 3) Antalgiques (paracétamol, codéine, tramadol, etc.). 4) Antibiothérapie générale (antistaphylococciques : Cloxacilline, Oxacilline ; ou fluoroquinolones) à discuter (non systématique, indiquée en cas de forme sévère, d’immunodépression, ou d’échec des traitements locaux). Le document précise : +/- ATB général. La durée de traitement est de 7 à 10 jours.,Le document détaille le traitement de l’OE diffuse.","Medium"
"Quelles sont les complications possibles de l’otite externe, citées dans le document ?",Les complications de l’otite externe sont : chondrite (infection du cartilage), périchondrite (inflammation du périchondre), abcès péri-auriculaire, cellulite faciale, ostéite (du tympanal puis de la base du crâne), septicémie. Ces complications surviennent surtout dans les formes malgiques (otite externe nécrosante), chez les patients immunodéprimés (diabétiques, immunodéprimés) ou en l’absence de traitement adapté. Elles engagent le pronostic fonctionnel (paralysie faciale) et vital (méningite, abcès cérébral, septicémie).,Le document cite ces complications dans la section dédiée.","Medium"
"Expliquez la prise en charge spécifique de l’otomycose.",L’otomycose (otite externe mycosique) se distingue par un prurit intense et des filaments blanchâtres ou noirâtres à l’otoscopie. La prise en charge spécifique comprend : 1) Soins locaux (nettoyage du MAE avec détersion douce). 2) Antalgiques si nécessaire (la douleur est moins intense que dans la forme bactérienne). 3) Antifongiques locaux (Auricularum, Mycoster spray) pendant 15 à 30 jours (traitement prolongé pour éviter les récidives). 4) Pas d’antibiotiques locaux (aggraverait la mycose). 5) Traitement des facteurs favorisants (humidité, baignades). Les corticoïdes locaux sont à éviter en l’absence d’inflammation majeure. L’évolution est généralement favorable mais les récidives sont fréquentes si la durée de traitement est insuffisante.,Le document précise : otomycose : soins locaux, antalgique, antifongique local 15-30 jours.","Medium"
"Un patient consulte pour une otalgie intense, une sensation d’oreille bouchée. À l’otoscopie, le MAE est sténosé et très douloureux. Le tympan n’est pas visible. Quel est le diagnostic le plus probable et comment faire la différence avec une otite moyenne aiguë ?",Le diagnostic le plus probable est une otite externe diffuse (ou un furoncle). La différence avec une otite moyenne aiguë (OMA) repose sur : dans l’OMA, la douleur n’est pas exacerbée par la traction du pavillon ou la pression du tragus (sauf si otite externe associée), le tympan est visible (injecté, bombant), et l’otorrhée (si présente) est purulente mais non fétide. Dans l’otite externe, la traction de l’auricule est très douloureuse (signe pathognomonique), le tympan n’est pas visible (sténose), l’otorrhée est claire d’abord puis purulente. La pression du tragus est douloureuse. L’otoscopie sous anesthésie locale ou après détersion est parfois nécessaire. Le document cite l’OMA dans le diagnostic différentiel de l’otalgie/sténose.,Le document liste l’OMA comme diagnostic différentiel de l’otalgie/sténose.","Difficult"
"Pourquoi l’otite externe maligne nécessite-t-elle une imagerie (scanner/IRM/scintigraphie) ?",L’imagerie est nécessaire pour : 1) Évaluer l’extension de l’infection aux parties profondes : chondrite, ostéite du tympanal, ostéite de la base du crâne, atteinte des parties molles péri-auriculaires. 2) Rechercher une collection abcédée nécessitant un drainage chirurgical. 3) Détecter une atteinte des paires crâniennes (paralysie faciale, autres). 4) Guider une éventuelle chirurgie (évidement pétromastoïdien). 5) Faire le diagnostic différentiel avec une tumeur ou une autre pathologie de la base du crâne. 6) Surveiller l’évolution sous traitement (scanner de contrôle). Le scanner en coupes inframillimétriques est l’examen de référence. L’IRM est utile pour les parties molles, la scintigraphie pour l’ostéite active.,Le document mentionne TDM/IRM/scintigraphie pour l’OE maligne.","Medium"
"Quels sont les quatre critères d’amélioration clinique (guérison) d’une otite externe bien traitée ?",Les quatre critères d’amélioration clinique sont : 1) Sédation de la douleur (disparition de l’otalgie), 2) Amélioration de l’audition (disparition de l’hypoacousie sur sténose), 3) Normalisation du calibre du MAE (disparition de la sténose inflammatoire), 4) Rétablissement de la peau du MAE (disparition de l’érythème, des lésions, de l’otorrhée). Ces critères sont généralement obtenus en 7 à 10 jours de traitement bien conduit. L’absence d’amélioration doit faire rechercher une erreur diagnostique, une cause sous-jacente (diabète, immunodépression) ou une forme compliquée (OE maligne, abcès).,Le document liste ces critères dans Résultats et pronostic.","Medium"
"Un patient avec otite externe chronique se plaint de prurit et d’otorrhée depuis des mois. À l’otoscopie, le MAE est comblé de débris boueux noirâtres. Quelle est la conduite à tenir ?",La conduite à tenir devant une otite externe chronique à débris boueux noirâtres (souvent mycosique ou mixte) comprend : 1) Détersion soigneuse du MAE (nettoyage, aspiration) pour visualiser le tympan et éliminer les débris. 2) Prélèvement mycologique et bactériologique. 3) Antifongiques locaux prolongés (15-30 jours), parfois associés à des corticoïdes locaux (anti-inflammatoires). 4) Traitement des facteurs favorisants : humidité chronique, manipulations intempestives, eczéma associé, diabète sous-jacent. 5) Surveillance à long terme car les récidives sont fréquentes. 6) Si échec du traitement local, discuter un traitement systémique (antifongiques oraux : fluconazole) et rechercher une immunodépression. Le document insiste sur l’aspect comblement du MAE par débris boueux noirâtre ou blanchâtre.,Le document décrit l’OE chronique.","Medium"
"Quelles sont les indications de la chirurgie dans l’otite externe ?",Les indications chirurgicales sont : 1) Furoncle du MAE collecté : incisio-drainage de la collection purulente (plus efficace que l’évolution spontanée et soulagement rapide de la douleur). 2) Otite externe maligne compliquée d’abcès profond, d’ostéite résistante aux antibiotiques ou de séquestres osseux : évidement pétromastoïdien ou pétrectomie (résection chirurgicale des zones nécrotiques). 3) Complications : drainage d’un abcès péri-auriculaire, prise en charge d’une chondrite nécrosante. La chirurgie reste exceptionnelle, réservée aux formes graves ou aux échecs du traitement médical bien conduit (8 semaines d’antibiotiques IV dans l’OE maligne). Le document cite : incision/drainage, évidement pétromastoïdien ou pétrectomie.,Le document mentionne les actes chirurgicaux dans les moyens.","Medium"
"Expliquez pourquoi l’otite externe est plus fréquente chez les nageurs (oreille du nageur).",L’oreille du nageur (otite externe du baigneur) est favorisée par l’immersion prolongée en piscine ou en eau stagnante. L’eau macère la peau du méat acoustique externe, ramollit le cérumen (perturbant son rôle protecteur), et crée une humidité persistante favorable à la prolifération bactérienne (Pseudomonas aeruginosa, Staphylococcus) et fongique. Les baignades répétées lessivent le cérumen, diminuent le pH acide naturel du conduit (normalement protecteur), et les micro-organismes des piscines (eau non stérile) colonisent facilement. Le grattage après la baignade aggrave les micro-lésions. Le document cite la baignade en piscine comme facteur favorisant. La prévention repose sur l’utilisation de bouchons d’oreille et le séchage du conduit après chaque bain.,Le document mentionne bain en piscine comme FDR.","Medium"
"Quel est le rôle du cérumen dans la prévention de l’otite externe ?",Le cérumen a un rôle protecteur essentiel : 1) Barrière physique : il piège les poussières, les micro-organismes et les corps étrangers. 2) Acidité : le pH acide du cérumen (pH ~4-5) inhibe la prolifération bactérienne et fongique (la plupart des germes pathogènes préfèrent un pH neutre ou alcalin). 3) Propriétés antibactériennes : il contient du lysozyme, des immunoglobulines et des acides gras aux propriétés antimicrobiennes. 4) Effet hydratant : il maintient la peau du conduit souple et intacte. La perturbation de cette barrière (par nettoyage excessif, coton-tiges, baignades, grattage) favorise la survenue d’une otite externe. Le document précise : secondaire à une perturbation du rôle protecteur du cérumen.,Le document mentionne le rôle protecteur du cérumen.","Medium"