"question","option1","option2","option3","option4","answer","explanation","difficulty"
"Quelle est la définition du glaucome chronique à angle ouvert selon le document ?","Une hypertonie oculaire isolée","Une neuropathie optique antérieure chronique et progressive avec hypertonie oculaire, excavation capillaire et altérations du champ visuel","Une cataracte compliquée","Une atteinte inflammatoire de l’uvée","2","Le document définit le GCAO comme « une neuropathie optique antérieure, d’évolution chronique et progressive, généralement accompagnée d’une hypertonie oculaire, associée à une excavation capillaire et des altérations du champ visuel ».","Easy"
"Quelle est la prévalence du glaucome chronique à angle ouvert parmi les glaucomes ?","10 à 20%","30 à 40%","50 à 70%","80 à 90%","3","Le document indique : « C’est le type le plus fréquent des glaucomes (50 à 70% des glaucomes) ».","Easy"
"Quelle est la première cause de cécité dans le monde selon le document ?","Glaucome chronique","Cataracte","DMLA","Rétinopathie diabétique","2","Le document précise : « C’est la deuxième cause de la cécité dans le monde après la cataracte ».","Easy"
"À quel âge débute généralement le glaucome chronique à angle ouvert ?","20-30 ans","40-50 ans","60-70 ans","Après 80 ans","2","Le document indique : « Il débute en général vers 40-50 ans ».","Easy"
"Quel est le pourcentage d’hérédité retrouvée dans le GCAO ?","5%","10%","20%","40%","3","Le document précise : « 20% d’hérédité retrouvée ».","Easy"
"Quel est le grand symptôme du GCAO au début ?","Douleurs oculaires","Rougeur conjonctivale","Aucun symptôme","Baisse brutale de l’acuité visuelle","3","Le document insiste : « Le grand symptôme c’est qu’au début, il n’y a aucun symptôme +++ ».","Easy"
"À partir de quel âge un patient consultant pour presbytie doit-il bénéficier d’une prise de PIO systématique selon le document ?",">30 ans",">35 ans",">45 ans",">60 ans","3","Le document indique : « Le GCAO doit être dépisté à ce stade par prise de PIO systématique chez un patient qui consulte pour une presbytie (>45ans) ».","Easy"
"Quelle est la valeur seuil de PIO considérée comme normale ?","<18 mmHg","<20 mmHg","<21 mmHg","<25 mmHg","3","Le document indique : « PIO > 21 mm de Hg » pour définir l’hypertonie.","Easy"
"Quel est le rapport Cup/Disc considéré comme normal selon le document ?","0,1","0,2","0,4","0,6","3","Le document précise : « Un C/D à 0,4 est considéré comme normal ».","Easy"
"Quel examen permet d’évaluer l’ouverture de l’angle ?","Fond d’œil","Gonioscopie","Tonométrie","OCT","2","Le document indique : « Gonioscopie systématique et bilatérale […] Angle ouvert ».","Easy"
"Quel est le premier traitement médical du GCAO en première intention selon le document ?","Collyres analogues des prostaglandines","Collyres bêtabloquants","Collyres myotiques","Collyres alpha-2-adrénergiques","2","Le document précise : « Collyres bêtabloquants : En première intention ».","Easy"
"Quel est le mécanisme d’action des bêtabloquants dans le GCAO ?","Augmentation de l’écoulement uvéo-scléral","Diminution de la sécrétion au niveau des procès ciliaires","Inhibition de l’anhydrase carbonique","Myosis","2","Le document indique : « Diminue la sécrétion au niveau des procès ciliaires ».","Easy"
"Quel est le nom commercial du latanoprost cité dans le document ?","Timoptol","Trusopt","Xalatan","Alphagan","3","Le document précise : « Latanoprost (Xalatan*) ».","Easy"
"Quel collyre est un inhibiteur de l’anhydrase carbonique mentionné dans le document ?","Timolol","Trusopt (acétazolamide)","Pilocarpine","Brimonidine","2","Le document indique : « Collyre à l’acétazolamide (Trusopt*) = inhibiteur de l’anhydrase carbonique ».","Easy"
"À quel stade l’acuité visuelle s’effondre-t-elle dans le GCAO ?","Au début","Au stade modéré","Au stade terminal","Jamais","3","Le document précise : « au stade agonique, l’AV s’effondre pour aboutir à la cécité ».","Easy"
"Quel est l’aspect du champ visuel au stade préterminal du GCAO ?","Hémianopsie latérale homonyme","Vision tubulaire ou en canon de fusil","Scotome central","Rétrécissement nasal isolé","2","Le document décrit : « vision tubulaire », « en canon de fusil », « le patient n’arrive pas à se déplacer malgré son 10/10 ».","Easy"
"Quel est le mécanisme d’action de la pilocarpine dans le GCAO ?","Diminution de la sécrétion","Provoque un étirement du trabeculum, facilite l’écoulement de l’humeur aqueuse","Inhibition de l’anhydrase carbonique","Augmentation de la sécrétion","2","Le document indique : « Pilocarpine : Provoque un étirement du trabeculum, facilite l’écoulement de l’humeur aqueuse ».","Easy"
"Quel traitement chirurgical filtrant est décrit comme une intervention où l’on enlève un morceau de trabéculum ?","Sclérectomie profonde non perforante","Trabéculectomie","Iridotomie laser","Trabéculoplastie","2","Le document précise : « Trabéculectomie : on enlève un morceau de trabéculum sous un volet de sclère et de conjonctive ».","Easy"
"Quels sont les trois signes cardinaux du GCAO selon l’introduction ?","Douleur, rougeur, baisse d’AV","Hypertonie oculaire, excavation capillaire, altérations du champ visuel","Myosis, buphtalmie, cataracte","Céphalées, nausées, vomissements","2","Le document liste : hypertonie oculaire, excavation capillaire, altérations du champ visuel.","Easy"
"Quel est le mode de transmission du GCAO selon le document ?","Autosomique dominant","Autosomique récessif","Lié à l’X","Mode de transmission mal connue","4","Le document indique : « 20% d’hérédité retrouvée, mode de transmission mal connue ».","Easy"
"Quel facteur de risque oculaire est mentionné dans le document ?","Hypermétropie","Myopies fortes > 6 dioptries","Astigmatisme","Presbytie","2","Le document liste : « Myopies fortes > 6 dioptries » comme facteur de risque oculaire.","Easy"
"Quel est le scotome typique évolué du GCAO décrit dans l’examen du champ visuel ?","Scotome central","Scotome de Bjerrum","Scotome périphérique","Scotome altitudinal","2","Le document mentionne : « Scotome de Bjerrum ».","Medium"
"Pourquoi la mesure de l’acuité visuelle n’est-elle pas un paramètre primordial de surveillance dans le GCAO ?","Parce qu’elle est difficile à mesurer","Parce qu’elle reste normale jusqu’à l’extrême limite","Parce qu’elle varie trop","Parce qu’elle n’est pas fiable","2","Le document précise : « La mesure de l’acuité visuelle n’est pas un paramètre primordial de la surveillance car elle reste normale jusqu’à l’extrême limite ».","Medium"
"Quelle est la différence entre la trabéculectomie et la sclérectomie profonde non perforante ?","La trabéculectomie est au laser, la sclérectomie est chirurgicale","La sclérectomie n’ouvre pas l’œil alors que la trabéculectomie ouvre l’œil","La trabéculectomie concerne l’angle, la sclérectomie concerne la cornée","Il n’y a pas de différence","2","Le document indique pour la sclérectomie : « même type d’opération que la trabéculectomie sauf qu’on n’ouvre pas l’œil ».","Medium"
"Quel est le mécanisme d’action des analogues des prostaglandines (Xalatan) ?","Diminution de la sécrétion","Augmentation de l’écoulement","Myosis","Diminution de l’écoulement","2","Le document précise : « Latanoprost (Xalatan*) : augmentation de l’écoulement ».","Medium"
"Quel est le mécanisme d’action de la brimonidine (Alphagan) ?","Diminution de la sécrétion uniquement","Augmentation de l’écoulement uniquement","Diminution de la sécrétion et augmentation de l’écoulement par voie uvéo-sclérale","Inhibition de l’anhydrase carbonique","3","Le document indique : « Brimonidine (Alphagan*) : diminution de la sécrétion de l’HA et augmentation de l’écoulement par voie uvéo-sclérale ».","Medium"
"Quelle est la particularité du stade préterminal du GCAO concernant l’acuité visuelle ?","L’acuité visuelle est déjà nulle","L’acuité visuelle est effondrée","L’acuité visuelle est à 10/10 et Parinaud 2 mais le patient ne peut pas se déplacer","L’acuité visuelle est normale avec un champ visuel normal","3","Le document précise : « Vision 10/10 et Parinaud 2 mais en canon de fusil, le patient n’arrive pas à se déplacer malgré son 10/10 ».","Medium"
"Quel est l’ordre thérapeutique proposé en première intention, puis après échec ?","D’abord Xalatan, puis Timoptol","D’abord Timoptol, puis Xalatan","D’abord chirurgie, puis collyres","D’abord laser, puis collyres","2","Le document indique : « En première intention : le plus souvent Les Timoptol. Si échec ou intolérance : on change de collyre -> Xalatan ».","Medium"
"Quelle est l’indication de la trabéculoplastie au laser à l’Argon (TRLA) ?","En première intention","Après échec du traitement médical","En cas de chirurgie échouée","Uniquement chez l’enfant","2","Le document précise : « Réalisée si les collyres (traitements médicaux) sont un échec ».","Medium"
"Dans quel cas particulier la chirurgie peut-elle être proposée plus tôt selon le document ?","Sujet âgé de plus de 80 ans","Sujet de 20 ans avec glaucome pigmentaire","Patient diabétique","Patient hypertendu","2","Le document indique : « Dans certaines formes cliniques, la chirurgie peut être proposée plus tôt. Ex : sujet de 20 ans avec glaucome pigmentaire ».","Medium"
"Quels sont les trois examens de surveillance annuelle du GCAO cités dans le document ?","AV, PIO, FO","PIO, champ visuel, état des papilles au FO","OCT, angiographie, échographie","Gonioscopie, tonométrie, biopsie","2","Le document liste : « Mesure de la PIO, Champ visuel, Etat des papilles par le FO régulier ».","Medium"
"Que mesure l’OCT (tomographie à cohérence optique) dans le suivi du GCAO selon le document ?","L’acuité visuelle","La PIO","L’épaisseur des fibres optiques de la papille","L’angle irido-cornéen","3","Le document précise : « Tomographie à cohérence optique (OCT), mesure l’épaisseur des fibres optiques de la papille ».","Medium"
"Quel est le premier signe de début du GCAO sur le champ visuel selon le document ?","Perte périphérique totale","Déficit initial situé dans le 30° central, élargissement de la tâche aveugle","Hémianopsie","Scotome périphérique","2","Le document indique : « Déficit initial situé dans le 30° central, Elargissement de la tâche aveugle ».","Medium"
"Pourquoi le GCAO est-il considéré comme grave selon le document ?","Parce qu’il est douloureux","Parce qu’il évolue de façon insidieuse sans douleur ni rougeur ni baisse visuelle pendant des années, retardant le diagnostic","Parce qu’il est contagieux","Parce qu’il est fréquent chez l’enfant","2","Le document précise : « Grave, évolue de façon insidieuse sans douleur ni rougeur ni baisse visuelle (sauf au stade terminal) pendant des années ».","Medium"
"Un patient de 55 ans, asymptomatique, a une PIO à 28 mmHg, un rapport C/D à 0,7, et un angle ouvert à la gonioscopie. Quel est le diagnostic le plus probable ?","Glaucome aigu par fermeture de l’angle","Glaucome chronique à angle ouvert","Hypertonie oculaire isolée","Glaucome cortisonique","2","L’association PIO élevée, excavation (C/D élevé), angle ouvert, asymptomatique correspond au GCAO.","Difficult"
"Un patient glaucomateux chronique a une PIO contrôlée à 16 mmHg sous bithérapie mais son champ visuel se détériore progressivement. Quelle hypothèse physiopathologique peut expliquer cette aggravation ?","Mauvaise observance thérapeutique uniquement","Existence de facteurs de risque vasculaires (hypotension artérielle, diabète) aggravant l’atrophie optique indépendamment de la PIO","Le traitement est inefficace par résistance","Le diagnostic est erroné","2","Le document mentionne les facteurs de risque vasculaires comme facteurs d’aggravation indépendants.","Difficult"
"Pourquoi propose-t-on une chirurgie plus précoce chez un patient de 20 ans atteint de glaucome pigmentaire ?","Parce que le glaucome pigmentaire est plus sévère","Pour éviter les problèmes d’observance du traitement médical sur plusieurs décennies","Parce que les collyres sont contre-indiqués chez le sujet jeune","Parce que le laser est inefficace","2","Le document indique : « pour éviter les problèmes d’observance, proposer la chirurgie ».","Difficult"