"question","answer","explanation","difficulty"
"Quelle est la définition de la drépanocytose ?","Anémie hémolytique constitutionnelle, transmise sur le mode autosomique récessif, due à une hémoglobine anormale Hb S.","Le document donne cette définition.","Easy"
"Quels sont les trois types d'hémoglobine retrouvés chez un patient drépanocytaire homozygote SS ?","Hb S, Hb F, Hb A2. Absence d'Hb A.","Le document : 'Présence d'Hb S, F et A2, Absence d'Hb A'.","Easy"
"Quel est le syndrome douloureux révélateur de la maladie chez le nourrisson ?","Le syndrome pied-mains : tuméfaction aiguë douloureuse du dos des mains et des pieds, survenant entre 6 et 18 mois.","Le document le décrit.","Easy"
"Pourquoi la drépanocytose est-elle asymptomatique avant 6 mois ?","En raison de la persistance de l'hémoglobine fœtale (HbF) qui empêche la polymérisation de l'HbS.","Le document : 'Hb F non encore remplacée par l'Hb S pathologique'.","Easy"
"Quels sont les deux examens paracliniques clés pour le diagnostic ?","Le test d'Emmel (falciformation) et l'électrophorèse de l'hémoglobine.","Le document les cite.","Easy"
"Citez quatre complications aiguës de la drépanocytose.","Crises vaso-occlusives (pied-mains, douleurs osseuses, syndrome thoracique aigu, AVC), séquestration splénique, érythroblastopénie aiguë (Parvovirus B19), infections (pneumonies, méningites, ostéomyélites, septicémies).","Le document les énumère.","Easy}
"Quel est le traitement préventif de base chez l'enfant drépanocytaire ?","Acide folique (1 mg/kg/j), antibioprophylaxie par pénicilline, vaccinations (PEV, Haemophilus influenzae, pneumocoque, méningocoque, salmonelles, hépatites).","Le document le donne.","Easy}
"Quel traitement peut espacer les crises vaso-occlusives ?","L'hydroxyurée (hydréa), un cytostatique.","Le document : 'Cytostatique (hydréa) permettrait d'espacer les crises'.","Easy}
"Quel est le traitement curatif potentiel de la drépanocytose ?","L'allogreffe de moelle osseuse.","Le document : 'allogreffes de la moëlle'.","Easy}
"Quelle complication est due au Parvovirus B19 ?","L'érythroblastopénie aiguë, avec chute brutale de l'hémoglobine.","Le document le mentionne.","Easy}
"Décrivez la physiopathologie de la drépanocytose.","Mutation ponctuelle de la chaîne β de l'hémoglobine. En condition de désoxygénation, l'HbS polymérise, formant des fibres hélicoïdales qui déforment les globules rouges en forme de faucille, diminuant leur déformabilité, entraînant une obstruction vasculaire et une hémolyse.","Le document : 'Mutation ponctuelle... polymérisation... falciformant... baisse de la déformabilité... hémolyse'.","Medium}
"Quels sont les signes cliniques de la drépanocytose homozygote SS chez l'enfant ?","Pâleur (anémie), ictère (hémolyse), splénomégalie, syndrome douloureux (pied-mains puis douleurs diffuses), souffle systolique, tachycardie, dyspnée.","Le document les décrit.","Medium}
"Quels sont les signes biologiques de l'anémie drépanocytaire ?","Anémie hémolytique régénérative (baisse d'Hb, réticulocytes élevés), présence d'HbS à l'électrophorèse, test d'Emmel positif.","Le document les cite.","Medium}
"Quelles sont les complications infectieuses fréquentes chez le drépanocytaire ?","Pneumonies, méningites (Haemophilus, salmonelle), ostéomyélites (salmonelle), septicémies.","Le document les liste.","Medium}
"Quel est le traitement d'une infection pulmonaire chez le drépanocytaire ?","Amoxicilline acide clavulanique associée à un macrolide.","Le document : 'Poumons : amoxicilline acide clavulanique, macrolides'.","Medium}
"Quel est le traitement d'une ostéomyélite ou méningite ?","Céphalosporine de 3e génération (C3G) associée à fosfomycine ou vancomycine.","Le document : 'C3G et fosfomycine ou vancomycine'.","Medium}
"Quelle est la prise en charge d'une crise vaso-occlusive douloureuse ?","Hydratation (3L/m2/j PO, 2L/m2/j IV), repos, antalgiques (paracétamol, ibuprofène, codéine).","Le document le donne.","Medium}
"Quel est le traitement de la séquestration splénique grave ?","Transfusion, surveillance, et si récidives graves, splénectomie.","Le document : 'Splénectomie si séquestration grave et augmentation de transfusion'.","Medium}
"Quel est le traitement d'un AVC chez l'enfant drépanocytaire ?","Échanges transfusionnels en urgence, puis programme transfusionnel.","Le document : 'Formes vasculo-occlusives : échanges transfusionnels'.","Medium}
"Quels sont les risques des transfusions répétées ?","Allo-immunisation, contamination virale (VIH, VHB, VHC), surcharge en fer.","Le document les cite.","Medium}
"Comment prévenir la surcharge en fer post-transfusionnelle ?","Par chélation du fer (Desferal).","Le document : 'Chélation du fer si transfusion multiple (Desferal)'.","Medium}
"Quel est le diagnostic différentiel d'une douleur abdominale chez un drépanocytaire ?","Appendicite aiguë, péritonite, invagination intestinale aiguë, hernie étranglée.","Le document les donne.","Medium}
"Quel est le diagnostic différentiel d'un syndrome anémique fébrile ?","Paludisme grave (coma, GEFM, zone endémique).","Le document : 'Paludisme grave compliquée : coma, GEFM, ZEP'.","Medium}
"Quel est le diagnostic différentiel d'une douleur ostéoarticulaire ?","Ostéomyélite, arthrite, rhumatisme articulaire aigu (RAA).","Le document les cite.","Medium}
"Un enfant drépanocytaire de 2 ans a une fièvre à 39°C, une toux, une douleur thoracique, une hypoxie. Quel est le diagnostic le plus probable et que faire ?","Syndrome thoracique aigu. Hospitalisation, oxygénothérapie, hydratation, antalgiques, antibiotiques (amoxicilline-acide clavulanique + macrolide), échanges transfusionnels si aggravation.","Basé sur le document.","Medium}
"Un enfant drépanocytaire de 8 ans a une douleur brutale de la hanche, fièvre, impotence fonctionnelle. Quel diagnostic et quel traitement ?","Ostéomyélite à salmonelle. Traitement : C3G + fosfomycine ou vancomycine.","Basé sur le document.","Medium}
"Un enfant drépanocytaire de 10 ans a une hémiplégie brutale. Quelle est la conduite à tenir ?","Urgence : suspecter un AVC. Hospitalisation, échanges transfusionnels, imagerie cérébrale.","Basé sur le document.","Medium}
"Un enfant drépanocytaire a une pâleur intense, une splénomégalie massive apparue en quelques heures. Quel diagnostic et quel traitement ?","Crise de séquestration splénique. Traitement : transfusion de culot globulaire, surveillance, splénectomie si récidives.","Basé sur le document.","Medium}
"Un enfant drépanocytaire a une fièvre, une raideur de nuque, une fontanelle bombée. Quel diagnostic et quel traitement ?","Méningite (à Haemophilus ou salmonelle). Traitement : C3G + fosfomycine, ponction lombaire.","Basé sur le document.","Medium}
"Quelle est la particularité de la forme hétérozygote AS ?","Généralement asymptomatique, découverte fortuite.","Le document le dit.","Medium}
"Quelle est la particularité de la forme composite S bêta-thalassémie ?","Présentation et prise en charge identiques à la forme SS.","Le document le précise.","Difficult}
"Un enfant drépanocytaire a une crise douloureuse des membres. Quels antalgiques utiliser en première intention ?","Paracétamol (15 mg/kg) et/ou ibuprofène (10 mg/kg), associés à codéine si nécessaire.","Basé sur le document.","Difficult}
"Quel est l'intérêt du diagnostic prénatal de la drépanocytose ?","Permettre le conseil génétique aux parents et préparer la prise en charge à la naissance.","Le document : 'Diagnostic prénatal pour conseil génétique, diagnostic anténatal positive'.","Difficult}
"Pourquoi la vaccination anti-pneumocoque est-elle particulièrement importante ?","Car les enfants drépanocytaires ont une asplénie fonctionnelle et sont très sensibles aux infections à pneumocoque.","Le document mentionne la vaccination pneumocoque.","Difficult}
"Quel est le risque d'une infection à Parvovirus B19 chez le drépanocytaire ?","Chute brutale de l'hémoglobine (érythroblastopénie) pouvant nécessiter une transfusion.","Le document le cite.","Difficult}
"Comment différencier une crise vaso-occlusive d'une ostéomyélite ?","L'ostéomyélite s'accompagne de fièvre élevée, d'un syndrome inflammatoire biologique marqué, et d'une hyperleucocytose à PNN, tandis que la crise vaso-occlusive peut avoir une fièvre modérée et une douleur sans signe infectieux. L'imagerie (IRM, scintigraphie) aide au diagnostic.","Basé sur les diagnostics différentiels.","Difficult}
"Quel est le traitement de la crise de séquestration splénique ?","Transfusion de culot globulaire, correction de l'hypovolémie, surveillance.","Le document le mentionne.","Difficult}
"Quels sont les critères d'hospitalisation d'un enfant drépanocytaire ?","Fièvre inexpliquée, douleur sévère, anémie aiguë, splénomégalie soudaine, signes neurologiques, syndrome thoracique aigu.","Le document : 'Si fièvre : discuter une hospitalisation'.","Difficult}
"Quel est le rôle de l'hydréa (hydroxyurée) dans la drépanocytose ?","Augmenter le taux d'HbF, réduire les crises vaso-occlusives, espacer les hospitalisations.","Le document : 'permettrait d'espacer les crises'.","Difficult}
"Pourquoi les transfusions doivent-elles être phénotypées ?","Pour éviter l'allo-immunisation, fréquente chez les patients polytransfusés.","Le document : 'culot phénotypé et filtré'.","Difficult}
"Quelle est la complication à long terme des transfusions multiples ?","Hémochromatose secondaire (surcharge en fer) atteignant le cœur, le foie et les glandes endocrines.","Le document mentionne surcharge fer.","Difficult}
"Quel est le traitement de la surcharge en fer ?","Chélateurs du fer (Desferal, Exjade).","Le document : 'Desferal'.","Difficult}
"Un enfant drépanocytaire a un priapisme depuis 4 heures. Que faire ?","Urgence : hydratation, antalgiques, échanges transfusionnels. Si échec, drainage.","Basé sur le document.","Difficult}
"Quels sont les germes responsables d'ostéomyélite chez le drépanocytaire ?","Salmonella, Staphylococcus aureus.","Le document cite Salmonella.","Difficult}
"Quels sont les germes responsables de méningite chez le drépanocytaire ?","Haemophilus influenzae, pneumocoque, méningocoque.","Le document cite Haemophilus et salmonelle.","Difficult}
"Quel est le pronostic de la drépanocytose en Afrique ?","Mortalité élevée entre 6 mois et 5 ans, mais améliorable par une meilleure prise en charge.","Le document : 'Mortalité élevée en Afrique entre M6 et A5'.","Difficult}
"Quelle est l'importance du statut vaccinal chez le drépanocytaire ?","Essentielle pour prévenir les infections à germes encapsulés (pneumocoque, méningocoque, Haemophilus).","Le document le souligne.","Difficult}
"Un enfant drépanocytaire a une douleur abdominale, une fièvre, une défense localisée. Comment différencier une crise vaso-occlusive abdominale d'une appendicite ?","La crise vaso-occlusive abdominale est souvent associée à d'autres localisations douloureuses, pas de syndrome inflammatoire biologique important. L'échographie abdominale peut aider à visualiser l'appendice.","Basé sur diagnostic différentiel.","Difficult}
"Quel est le traitement de la crise vaso-occlusive sévère résistante aux antalgiques usuels ?","Hospitalisation, hydratation IV, antalgiques opioïdes (morphine), échanges transfusionnels si aggravation.","Basé sur le document.","Difficult}
"Quelle est la prévalence de la drépanocytose en France ?","Non mentionné dans le document.","Difficult}